judul,date,bulan,tahun
Jumlah Mualaf di Prancis Naik Dua Kali Lipat usai Macron Hina Islam,2020-11-01,november,2020
Foto Ini Gambarkan Suasana Vaksinasi Covid-19 di Peru,2020-11-01,november,2020
Daerah Bahaya Merapi Diperluas Jadi 10 Km,2020-11-01,november,2020
Hasil Sidang Dewan Pengupahan Provinsi Jatim membahas Upah Minimum Kabupaten/Kota (UM2021,2020-11-01,november,2020
Moeldoko Singgung Revolusi Akhlak di Media Sosial,2020-11-01,november,2020
Tulisan JK Sebut Jokowi Sedang Diganggu Elite Politik dari Kekuasaan Orde Baru,2020-11-01,november,2020
Pernyataan Eddy Sariaatmaja Terkait Tayangan TV,2020-11-01,november,2020
5 Dokter Meninggal Dunia karena Covid-19 pada 18 November 2020,2020-11-01,november,2020
Istana Presiden Jadi Sarang Prostitusi,2020-11-01,november,2020
RSUP DSardjito Kolaps karena Paramedis Terpapar Covid-19,2020-11-01,november,2020
Heboh Kemunculan Seekor Harimau di Gunung Halimun Sukabumi,2020-11-01,november,2020
Video Rusuh di Petamburan,2020-11-01,november,2020
Pandemi Corona sudah Berakhir (Release dari Aliansi Dokter Duni,2020-11-01,november,2020
Mahathir Mohamad Beri Komentar soal Pendidikan di Indonesia,2020-11-01,november,2020
Dana Bantuan Pemerintah Rp100 Ribu untuk Pelanggan Setia PT Telekomunikasi Selular Indonesia,2020-11-01,november,2020
Angka Bunuh Diri di AS Meningkat 200 Persen Selama Pandemi Covid-19,2020-11-01,november,2020
Masyarakat Zimbabwe Terkena Penyakit Kulit Berair Akibat Vaksin dan Kemungkinan Besar Indonesia Bisa  ,2020-11-01,november,2020
Pesan Berantai Mengatasnamakan Blood for Life Indonesia (Blood4LifeI,2020-11-01,november,2020
Khusus Non Muslim Gratis BBM 2 Liter Setiap Baca Syahadat,2020-11-01,november,2020
Kutipan Pidato Muammar Khadaffi terkait Virus dan Vaksin dalam Sidang PBB,2020-11-01,november,2020
Vaksin Covid-19 AstraZeneca Gunakan Jaringan Janin Aborsi,2020-11-01,november,2020
Lowongan Kerja Transjakarta,2020-11-01,november,2020
Banyak Pedagang Pasar Gede Solo Positif Corona,2020-11-01,november,2020
Akun WhatsApp Mengaku Jubir Satgas Covid-19 Kota Malang,2020-11-01,november,2020
Mayjen Dudung Mengaku Diperintahkan Oleh Jokowi untuk Menyerang HRS dan Para Ulama,2020-11-01,november,2020
Swab Test Berbahaya Karena Dapat Menyebabkan Lapisan Otak Pecah Sebagaimana Telah Terjadi di Kanada,2020-11-01,november,2020
Video Tanah Longsor di Dairi Tanggal 23 November 2020,2020-11-01,november,2020
Pangdam Jaya Dudung Dapat Penghargaan dari Komunis Tiongkok,2020-11-01,november,2020
"Info Lowongan Kerja di Puskesmas Wisma Indah, Bojonegoro Jawa Timur",2020-11-01,november,2020
Pesan Berantai Wakil Wali Kota Probolinggo Meninggal,2020-11-01,november,2020
Surat Panggilan Interview Mengatasnamakan PT Gudang Garam Tb,2020-11-01,november,2020
Presiden Jokowi dan Moeldoko Batalkan UU Cipta Kerja,2020-11-01,november,2020
Rakyat Indonesia akan Dibunuh Vaksin China,2020-11-01,november,2020
Potret Kekerasan Terhadap Ulama dan Santri di Madiun 1948,2020-11-01,november,2020
Jokowi Perintahkan Kirim Koopssus ke Petamburan,2020-11-01,november,2020
Video Bunuh Diri di Hotel Sahid Sunshine Soreang,2020-11-01,november,2020
Informasi Loker Staf Lab Vaksin RSU Mulia Hati Wonogiri,2020-11-01,november,2020
Aplikasi Infoloker Karawang Diretas,2020-11-01,november,2020
Akun Facebook Mengatasnamakan Bupati Kampar,2020-11-01,november,2020
Akun Facebook Mengatasnamakan Wakil Bupati Probolinggo,2020-11-01,november,2020
KFC Bagikan 3 Ribu Snack Bucket Gratis,2020-11-01,november,2020
Video yang Sebut Presiden Jokowi Copot Menkopolhukam Mahfud MD,2020-11-01,november,2020
Wanita di atas Panser Bernama 'Odilia Winneke' Editor Deticom Grup Gramedia,2020-11-01,november,2020
"Anies Membaca Buku ""Cara Licik Menang Pilpres 2024""",2020-11-01,november,2020
Vaksin Mengandung Aluminium Bisa Merusak Otak,2020-11-01,november,2020
Data Skor Hasil Debat Publik Paslon Pilkada Purbalingga Tahun 2020,2020-11-01,november,2020
Akun Twitter Mengatasnamakan Bank BRI,2020-11-01,november,2020
Ali Mochtar Ngabalin Ditangkap KPK,2020-11-01,november,2020
Video Buaya Muncul di Tanggamus Lampung,2020-11-01,november,2020
Fahri Hamzah Disebut Masuk Daftar Rombongan Maling Benih Lobster,2020-11-01,november,2020
Susi Pudjiastuti Menari di Atas Pecahan Beling Usai Edhy Prabowo Diciduk KPK,2020-11-01,november,2020
"Surabaya Kembali Zona Hitam, Risma Imbau Warga Tak Datang Ke TPS",2020-11-01,november,2020
Pesan Berantai Lowongan kerja PT Angkasa Pura I 30 November 2020,2020-11-01,november,2020
Pesan Terakhir Bupati Situbondo Sebelum Meninggal Akibat Covid-19,2020-11-01,november,2020
Rekrutmen Kerja Oleh PT PLN Yogyakarta pada November 2020,2020-11-01,november,2020
"Mengonsumsi Bawang Putih, Bawang Bombai, dan Jeruk Nipis yang Dihaluskan Bisa  ",2020-11-01,november,2020
Hasil Survei Paslon Pilkada Makassar,2020-11-01,november,2020
Lelang Mengatasnamakan Direktorat Jenderal Bea dan Cukai,2020-11-01,november,2020
Nike Bagi-Bagi Ribuan Sepatu dan Masker,2020-11-01,november,2020
Komunis Cina Disebut Manfaatkan TNI Untuk Adu Domba Rakyat,2020-11-01,november,2020
Presiden Jokowi Angkat Susi Pudjiastuti Gantikan Edhy Prabowo,2020-11-01,november,2020
Prabowo Subianto Dukung Paslon N01 Pilkada Kalimantan Tengah 2020,2020-11-01,november,2020
Foto Megawati dan Tri Risma Mendukung Paslon Nomor Urut 2 di Pilkada Surabaya 2020,2020-12-01,desember,2020
Air Garam Sumber Energi Listrik Penemuan Anak Bangsa,2020-12-01,desember,2020
Acara Haul Syeh Abdul Qadir Jailani Dihadiri Gubernur dan Kapolda Banten,2020-12-01,desember,2020
Miras di DKI Sudah Halal,2020-12-01,desember,2020
Kapolda Papua Sebut Tidak Bertanggung Jawab atas Penembakan Warga Sipil di KaPuncak Ilaga,2020-12-01,desember,2020
Surat Panggilan Seleksi Karyawan PT Waskita Karya Desember 2020,2020-12-01,desember,2020
Video Detik-detik Gunung Semeru Meletus,2020-12-01,desember,2020
"Bantuan dari Pemerintah Uang Tunai 2,4 Juta Bagi Peserta BPJS Kesehatan",2020-12-01,desember,2020
Surat Rekrutmen THL Satpol PP Kabupaten Gianyar,2020-12-01,desember,2020
Video Aksi Begal Payudara Dihajar Massa,2020-12-01,desember,2020
Pembegalan di Desa Dehuwalolo,2020-12-01,desember,2020
Pesan Berantai Lowongan Kerja Staf Lab Vaksin RS Citra Medika Lamongan,2020-12-01,desember,2020
Akun Whatsapp Anggota DPRD Kota Jambi Menawarkan Lelang Mobil,2020-12-01,desember,2020
Prabowo Subianto Mengundurkan Diri,2020-12-01,desember,2020
Bupati Bahrain Kasuba Menetapkan Dukungannya Kepada Paslon N2 Pilkada Halmahera Selatan 2020,2020-12-01,desember,2020
Ramuan Penyembuh Tumor dalam Waktu 24 Jam,2020-12-01,desember,2020
Operasi Masker Sampai 31 Desember dan Rapid Test atau Swab Test Ditempat Bagi Pelanggar di Kudus,2020-12-01,desember,2020
Pesan Berantai Asrama Isolasi Mandiri UGM Penuh,2020-12-01,desember,2020
Vaksin yang Disimpan Dalam Suhu -80 Derajat Bisa Memanipulasi Gen,2020-12-01,desember,2020
Video Aliran Lahar Dingin Gunung Semeru,2020-12-01,desember,2020
Pasien Covid-19 Asal Jeneponto Penuhi RS Stella Maris dalam Keadaan Parah,2020-12-01,desember,2020
Akun WhatsApp Paslon Apri – Roby Kabupaten Bintan,2020-12-01,desember,2020
"Konsumsi Buah Kesemek, Yoghurt, dan Pisang Dapat Menimbulkan Kondisi Keracunan",2020-12-01,desember,2020
Alfamart merayakan Ultah dengan membagikan voucher Rp800 ribu,2020-12-01,desember,2020
Puluhan Ekor Sapi Hanyut Terbawa Banjir di Sungai Deli Medan,2020-12-01,desember,2020
Indonesia Obral Murah Batubara ke Tiongkok Seharga Rp103 Ribu per Ton,2020-12-01,desember,2020
Foto Kampanye Rajiun Tumada di Marobo,2020-12-01,desember,2020
Kota Solo Lockdown pada 10 Desember hingga 20 Januari 2021,2020-12-01,desember,2020
Informasi Subsidi Kuota Internet dari Pemerintah Sebesar 35 GB,2020-12-01,desember,2020
Akun Twitter Mengatasnamakan Badan Intelijen Negara Republik Indonesia,2020-12-01,desember,2020
Foto Kolase Pelaku Pembantaian di Sigi Palu,2020-12-01,desember,2020
Video Anak Kecil Terlindas Mobil di SPBU Sumedang,2020-12-01,desember,2020
Satu RT Positif Covid-19 di Jalan Melong Cikawao Kota Bandung,2020-12-01,desember,2020
Akun Twitter Mengatasnamakan Bank Mandiri,2020-12-01,desember,2020
Informasi Sidak Masker di Kabupaten Jepara,2020-12-01,desember,2020
Foto Pasukan Tentara Asing Bertolak ke Papua Barat,2020-12-01,desember,2020
Vaksin Covid-19 Ditanami Barcode yang akan Masuk pada Tubuh Manusia,2020-12-01,desember,2020
Iriana Jokowi dan Inul Daratista Dukung Paslon N1 di Pilkada Malaka 2020,2020-12-01,desember,2020
Surat dari Mustofa Bisri (Gus Mu,2020-12-01,desember,2020
Prabowo Tangkap Benny Wenda,2020-12-01,desember,2020
MUI Memberi Sertifikasi Halal pada Kondom,2020-12-01,desember,2020
Akun Facebook Mengatasnamakan Anggota DPRD Banten Iip Makmur,2020-12-01,desember,2020
Akun Facebook Mengatasnamakan Wali Kota Sukabumi,2020-12-01,desember,2020
Video Longsor di Sambahe pada 5 Desember 2020,2020-12-01,desember,2020
Kantor Kemensos Terbakar Setelah Mensos Jadi Tersangka Kasus Korupsi,2020-12-01,desember,2020
Informasi Penerimaan Pegawai di Biro Umum & PBJ Setjen Kemendikbud,2020-12-01,desember,2020
KPK Periksa Kas Partai Gerindra,2020-12-01,desember,2020
Undangan Gerakan Subuh Akbar se-Kota Medan pada 9 Desember 2020,2020-12-01,desember,2020
Covid-19 adalah Senjata Biologis dari Laboratorium di North Carolina,2020-12-01,desember,2020
Akun Facebook Bupati Ade Yasin,2020-12-01,desember,2020
Awan Berbentuk Angka 2 Saat Pilkada Depok,2020-12-01,desember,2020
Salam Satu Jempol Jokowi untuk Mendukung Paslon N1 Pilkada Malaka 2020,2020-12-01,desember,2020
Video Bansos Kemensos Dimanfaatkan Salah Satu Paslon Pilwakot di Surabaya,2020-12-01,desember,2020
China Sembuh dari Covid-19 Tanpa Vaksin,2020-12-01,desember,2020
Surat Suara Sudah Tercoblos untuk Paslon N4 Pathul-Nursiah di Pilkada Lombok Tengah,2020-12-01,desember,2020
Video Salah Satu Pintu Air Bendungan Serayu Jebol,2020-12-01,desember,2020
Video Timses Paslon Pilkada Datangi Paranormal,2020-12-01,desember,2020
Video Bentrok Depan RS Efarina Etaham Purwakarta Tempat Rizieq Diduga Dirawat,2020-12-01,desember,2020
Surat Edaran Ajakan Umat Katolik pada Pilkada Sintang Kalbar,2020-12-01,desember,2020
KPK Terbitkan Sprindik Erick Thohir,2020-12-01,desember,2020
Tangkapan Layar WA Penyerangan HRS Mengatasnamakan Kapolda Metro Jaya yang di Muat Dalam Detikcom,2020-12-01,desember,2020
Prabowo Subianto Berpose Dua Jari untuk Pilkada Bontang,2020-12-01,desember,2020
Surat Suara Pilkada 2020 Dicoret-coret,2020-12-01,desember,2020
Video Tayangan Metro Tv Terkait Kampanye Salah Satu Calon Bupati Banggai,2020-12-01,desember,2020
Foto Artikel Akhyar Nasution Menang Telak atas Bobby Nasution,2020-12-01,desember,2020
Foto Imbas Bentrokan Polisi dengan Laskar FPI,2020-12-01,desember,2020
Prabowo Ultimatum Pemerintah Inggris Serahkan Benny Wenda,2020-12-01,desember,2020
Akun WhatsApp Mengatasnamakan Anggota DPD RI Fahira Idris,2020-12-01,desember,2020
"Cover Majalah Tempo Berjudul ""Sang Dalang Perusak Bhinneka""",2020-12-01,desember,2020
Operasi Tangkap Tangan Seorang Dokter di Surabaya Terkait Pilkada 2020,2020-12-01,desember,2020
Foto Ketua Komnas HAM Berdua dengan Tommy Soeharto,2020-12-01,desember,2020
Pendaftaran Penerima Vaksin Covid-19 Sinovac,2020-12-01,desember,2020
Video Banjir Hanyutkan Mobil di Sampang Madura,2020-12-01,desember,2020
Video Diklaim Konvoi Pendukung Gibran Usai Menang Pilkada Solo 2020,2020-12-01,desember,2020
Surat Permohonan Dana Bantuan Kegiatan Pembersihan Drainase dan Aliran Kali oleh Sekot Kendari,2020-12-01,desember,2020
Video Warga 1 RT di Ciracas Dievakuasi ke Wisma Atlet karena Covid-19,2020-12-01,desember,2020
Foto Bingkisan Paslon Pilwakot Mataram Tersebar di Hari Pencoblosan,2020-12-01,desember,2020
Warga Negara Indonesia Keturunan Tionghoa Dilarang Menjadi Anggota Polri,2020-12-01,desember,2020
6 Peserta Uji Coba Meninggal Dunia Setelah Suntikan Vaksin Pfizer,2020-12-01,desember,2020
Warga yang Masuk Kota Solo akan Dikarantina Mulai 15 Desember 2020,2020-12-01,desember,2020
Anies Baswedan Pergi Ke Korea Utara untuk melakukan Penyembuhan dari COVID-19,2020-12-01,desember,2020
Akun Facebook Mengatasnamakan Ketua DPRD Kota Tangerang Selatan,2020-12-01,desember,2020
"1,2 Juta Vaksin Covid-19 Dari Eropa Tiba di Indonesia",2020-12-01,desember,2020
Foto Awan sebagai Tanda Kemenangan Pasangan Calon Bupati Jember Nomor Urut 2,2020-12-01,desember,2020
"Foto ""Pemerintah sudah launching 2 mobil esemka terbaru series J-Owi warna hitam elegan""",2020-12-01,desember,2020
Pantangan untuk Tidak Mengadakan Natal di Kabupaten Landak,2020-12-01,desember,2020
Pesan Larangan ke Kota Malang oleh Kapolresta Malang,2020-12-01,desember,2020
Lowongan Kerja PAstra Daihatsu Motor,2020-12-01,desember,2020
Prabowo akan Bebaskan Rizieq Shihab,2020-12-01,desember,2020
Tips Agar Hasil Tes Swab PCR Covid-19 Negatif,2020-12-01,desember,2020
"Video Kecelakaan Mobil Pickup di Kota Metro, Lampung",2020-12-01,desember,2020
Video Gunung Semeru Kembali Erupsi pada 6 Desember 2020,2020-12-01,desember,2020
Akun Twitter Mengatasnamakan Customer Care Bank BNI,2020-12-01,desember,2020
"44 Tenaga Kesehatan Terpapar Covid-19 di RSUD Andi Makkasau, Kota Parepare",2020-12-01,desember,2020
Website Mengatasnamakan BPJS Kesehatan,2020-12-01,desember,2020
Syarat Pencairan BSU Guru Madrasah Non PNS adalah Membawa BPKB atau Sertifikat Tanah,2020-12-01,desember,2020
Pesan Berantai tentang Manado Zona Hitam,2020-12-01,desember,2020
IDI Tolak Jadi yang Pertama Divaksin Covid-19,2020-12-01,desember,2020
Singapura akan Lakukan Vaksinasi Covid-19 di Bandara Changi,2020-12-01,desember,2020
Bocah Papua ini Lantunkan Alquran dengan Sangat Merdu,2020-12-01,desember,2020
Kapolda Metro Jaya Tolak Diperiksa Komnas HAM,2020-12-01,desember,2020
Video Evakuasi Hewan Purba Menyerang Warga Magetan,2020-12-01,desember,2020
Tunggakan Iuran BPJS Kesehatan Lunas Cukup Bayar 6 Bulan,2020-12-01,desember,2020
Formaldehida dalam Vaksin Menyebabkan Leukemia Pada Anak,2020-12-01,desember,2020
Pemberhentian Pengurusan Surat Pernyataan Miskin (SPdi Kabupaten Blitar,2020-12-01,desember,2020
Pesan Berantai Rawan Begal di Mataram NTB,2020-12-01,desember,2020
Potret Foto Pekerja PT IMIP Morowali yang Akan Menyerang Warga Sekitar,2020-12-01,desember,2020
Facebook Tutup Akun Muhammadiyah,2020-12-01,desember,2020
Klaster Covid-19 Supermarket Sendys,2020-12-01,desember,2020
China Tidak Menggunakan Vaksin Buatan Sendiri Namun Memilih Menggunakan Vaksin Impor Dari Jerman,2020-12-01,desember,2020
Pelaku yang Sebut Polisi Dajjal adalah Karyawan BUMN,2020-12-01,desember,2020
Media Jepang Beritakan Bansos COVID-19 yang berasal dari Bantuan Perdana Menteri Jepang Dikorupsi,2020-12-01,desember,2020
Kaca Pos Lantas Perbaungan Ditembak OTK,2020-12-01,desember,2020
Pengumuman ITB Cuma Beri Beasiswa ke Mahasiswa Muslim,2020-12-01,desember,2020
Undian Berhadiah Uang hingga Mobil dari Bank Indonesi,2020-12-01,desember,2020
Perang antara Tenaga Kerja Asing dan Tenaga Kerja Indonesia di Morosi,2020-12-01,desember,2020
"Mendikbud: Belajar Tatap Muka Resmi Januari 2021, Anak Wajib Swab Test sebelum Sekolah",2020-12-01,desember,2020
Pesan Berantai Kota Madiun Terapkan PSBB saat Nataru,2020-12-01,desember,2020
"Akun Whatsapp Mengatasnamakan Wakil Wali Kota Malang, Minta Transfer Dana Pembangunan Masjid",2020-12-01,desember,2020
Din Syamsuddin Berpidato Pelanggaran HAM Indonesia di PBB,2020-12-01,desember,2020
Foto 4 Orang Alami Kelumpuhan pada Wajah setelah Divaksin Covid-19,2020-12-01,desember,2020
Foto Ketum PBNU KH Said Aqil Siradj Terkena Stroke,2020-12-01,desember,2020
Foto Keluarga Ugur Sahin Penemu Vaksin Covid-19 Pfizer,2020-12-01,desember,2020
Kabupaten Gowa Lockdown Tanggal 19 hingga 27 Desember 2020,2020-12-01,desember,2020
Penerima Vaksin Gratis Covid-19 Harus Jadi Peserta BPJS Aktif,2020-12-01,desember,2020
"Perbandingan Waktu Penemuan Vaksin Covid-19 dan Vaksin HIV, Flu serta Kanker",2020-12-01,desember,2020
Presiden Jokowi akan Disuntik Vaksin selain Sinovac,2020-12-01,desember,2020
Susi Pudjiastuti Deklarasikan Partai Humanis Indonesia,2020-12-01,desember,2020
Siaran Pers SPMB Politeknik Keuangan Negara (PKSTAN Tahun 2021 Mengatasnamakan BPPK Kemenkeu  ,2020-12-01,desember,2020
Presiden Jokowi Tak Mau Disuntik Vaksin Duluan,2020-12-01,desember,2020
"Foto Rombongan Koruptor, Tak Satupun yang Diborgol",2020-12-01,desember,2020
Video Kerumunan Gibran yang Bebas Hukuman,2020-12-01,desember,2020
Pesan Grup WhatsApp “To Firdaus We Ascend” atau “Ke Surga Kita Pergi”,2020-12-01,desember,2020
Akun Instagram Mengatasnamakan Pos Indonesia,2020-12-01,desember,2020
Foto Anggota Kepolisian yang Menjadi Korban Pembacokan dan Dibiarkan Komnas HAM,2020-12-01,desember,2020
Gubernur Riau Dilarikan ke ICU RSUD,2020-12-01,desember,2020
Video Kecelakaan Kendaraan Pikap di Lampung,2020-12-01,desember,2020
Seorang Perawat Pingsan Usai Disuntik Vaksin Covid-19,2020-12-01,desember,2020
Kapolda Metro Jaya Irjen Fadil Imran Dinonaktifkan,2020-12-01,desember,2020
Narasi Covid-19 dari Ahli Patologi Roger Hodkinson,2020-12-01,desember,2020
Akun Facebook Mengatasnamakan Bupati Ciamis,2020-12-01,desember,2020
Akun Facebook Mengatasnamakan Bupati Probolinggo Puput Tantriana Sari,2020-12-01,desember,2020
Tanah Longsor di Desa Kapung Kabupaten Grobogan,2020-12-01,desember,2020
Jokowi Akan Menggunakan Vaksin Pfizer dan Vaksin Sinovac Untuk Masyarakat,2020-12-01,desember,2020
Purworejo Lockdown Mulai 24 Desember,2020-12-01,desember,2020
Pesan Berantai Berisi Bukti Ilmiah Terkait Penularan Covid-19,2020-12-01,desember,2020
Vaksin Covid-19 Buatan Pfizer Berbentuk Vape,2020-12-01,desember,2020
Paus Fransiskus Mengatakan Vaksin Covid Sekarang Akan Diperlukan untuk Masuk Surga,2020-12-01,desember,2020
Hanya Indonesia yang Beli Vaksin Sinovac Tiongkok,2020-12-01,desember,2020
WHO Ungkap Vaksin Covid-19 Buatan Sinovac Paling Lemah,2020-12-01,desember,2020
Akun Facebook Mengatasnamakan Ketua DPRD Sampang Fadol Abd Rohim,2020-12-01,desember,2020
Yahya Staquf Ngamuk di Depan Menteri Agama Pilihan Jokowi Yaqut Cholil,2020-12-01,desember,2020
"Tidak Mendapatkan Bansos, Keluarga Ilma Kerap Makan Tepung Goreng",2020-12-01,desember,2020
Pertama Kalinya Pohon Natal Dipasang di Halaman Istana Negara Indonesia,2020-12-01,desember,2020
Alat Rapid Test Antigen Menunjukkan Hasil Positif saat Diberikan Coca-Cola,2020-12-01,desember,2020
Cek KK Penerima Bansos Uang Tunai Rp300 ribu / Bulan Mulai Januari 2021,2020-12-01,desember,2020
Akun Facebook Wakil Bupati terpilih Lampung Tengah Ardito Wijaya,2020-12-01,desember,2020
Tsunami Rawan Terjadi di Bulan Desember,2020-12-01,desember,2020
Negara Cina Buat Kantor Polisi di Indonesia,2020-12-01,desember,2020
Kebijakan Lockdown dan Menjaga Jarak Merupakan Strategi untuk Mencegah Revolusi,2020-12-01,desember,2020
"Purworejo Kabupaten dengan Kasus Covid-19 Tertinggi di Jawa Tengah, dan Keempat Tertinggi di Indonesia",2020-12-01,desember,2020
Rapid Test Antigen di Rest Area Tol Jatim,2020-12-01,desember,2020
Akun Facebook Mencatut Nama Gubernur Sumbar Mengajak Bergabung ke Grup Diskusi,2020-12-01,desember,2020
Rumah Sakit di Lockdown karena Pasien Vaksin Covid Pertama Mulai Makan Pasien Lain,2020-12-01,desember,2020
Tes PCR Tidak Bisa Deteksi Varian Baru Virus Covid-19,2020-12-01,desember,2020
"Artikel Mengatasnamakan Ketua Baznas RI, Prof Bambang Sudibyo",2020-12-01,desember,2020
Voucher Alfamart Berhadiah,2020-12-01,desember,2020
Akun WhatsApp Mencatut Nama Kasatpol PP Lhokseumawe Meminta Pulsa,2020-12-01,desember,2020
Konsumsi Kuning Telur Mentah Bisa Cerdaskan Anak,2020-12-01,desember,2020
KPK Tangkap Puan Maharani,2020-12-01,desember,2020
Subsidi Kuota Internet 75 Gb dari KPCPEN,2020-12-01,desember,2020
Pria Hamili 17 Wanita,2020-12-01,desember,2020
Potret Video Istora Senayan Digunakan Sebagai Tempat Karantina Pasien Covid-19,2020-12-01,desember,2020
Akun Facebook Mengatasnamakan Bupati Serang,2020-12-01,desember,2020
Pesan Sandiaga Uno di Hari Pertama Kerja sebagai Menteri Pariwisata dan Ekonomi Kreatif,2020-12-01,desember,2020
Alfamart Bagikan Kupon Rp3 Juta Dalam Karnaval Tahun Baru,2020-12-01,desember,2020
Menteri Agama Yaqut Cholil Tidak Lulus SMA,2020-12-01,desember,2020
Serangan Fajar Isi Rp7 Ribu di Pilkada Serentak 2020,2020-12-01,desember,2020
Artikel “Gawat! Mensos Risma Akan Hapus Semua BLT Untuk Kedepannya”,2020-12-01,desember,2020
Surat Edaran Mengatasnamakan Dinas Kesehatan Pemerintah Kota Palembang,2020-12-01,desember,2020
Razia STNK di Seluruh Wilayah Indonesia Tanggal 30 Desember 2020,2020-12-01,desember,2020
Sambal Bawang Dapat Cegah Covid-19,2020-12-01,desember,2020
Klaim Gibran Menyerahkan Diri ke KPK,2020-12-01,desember,2020
Bansos Terbengkalai di Pulogadung Sudah Kedaluwarsa,2020-12-01,desember,2020
Petugas Medis Pakai Jarum Palsu saat Vaksinasi,2020-12-01,desember,2020
Tiga Wanita Bintang Iklan Jamu Covid-19,2020-12-01,desember,2020
Peringatan Keras Menteri Prabowo Subianto Kepada Pemerintah Malaysia Terkait Penghinaan Lagu Indonesia  ,2020-12-01,desember,2020
Video GOR Jayabaya Kediri Digunakan Sebagai Tempat Isolasi Pasien Covid-19,2020-12-01,desember,2020
Bill Gates dan CEO Pfizer Menolak Disuntik Vaksin Covid-19,2020-12-01,desember,2020
Pemadaman Listrik pada Malam Tahun Baru,2020-12-01,desember,2020
Lima Bangsal Isolasi RSUD Dr Moewardi Penuh Pasien Covid-19 dan Akhirnya Buat Tenda Darurat di Depan IGD,2020-12-01,desember,2020
Vaksin Pfizer Buatan China,2020-12-01,desember,2020
Video Eksekusi Mati Para Koruptor di Cina,2020-12-01,desember,2020
"[HOAKS] Kondisi terkini Syekh Ali Jaber, dari tidak sadarkan diri sampai pecah paru-paru ",2021-01-01,januari,2021
[HOAKS] Surat Edaran Kompensasi Zona Merah Covid-19 Mengatasnamakan Bupati Temanggung ,2021-01-01,januari,2021
[DISINFORMASI] Video Siaran Langsung “Kapal Tenggelam 1 Januari 2021” ,2021-01-01,januari,2021
[DISINFORMASI] Pangeran Uni Emirat Arab Rayakan Natal Bersama Paus ,2021-01-01,januari,2021
[DISINFORMASI] Video Harimau Muncul di Hutan Jati Blora ,2021-01-01,januari,2021
[HOAKS] Penutupan Pintu Akses Masuk Tol di Surabaya ,2021-01-01,januari,2021
"[HOAKS] Razia STNK oleh Pemda, Dishub, dan Polri ",2021-01-01,januari,2021
[HOAKS] Akun WhatsApp Cawabup Tanjung Jabung Barat Hairan Meminjam Sejumlah Uang ,2021-01-01,januari,2021
"[DISINFORMASI] Artikel “Wagub DKI Bolehkan Warga Jual Terompet untuk Malam Tahun Baru, asalkan Tidak  ",2021-01-01,januari,2021
[HOAKS] Peringatan Pemerintah Inggris Tentang Bahaya Penggunaan Vaksin Covid-19 Pzifer/Biontech ,2021-01-01,januari,2021
[DISINFORMASI] Partai Komunis China Akui Kualitas Vaksin Negaranya Tak Layak ,2021-01-01,januari,2021
"[DISINFORMASI] Vaksin Sinovac hanya untuk Kelinci Percobaan, Tidak untuk Disebarluaskan ",2021-01-01,januari,2021
[DISINFORMASI] Video Ribuan Jamaah Tanpa Masker Sambut Kedatangan UAS ,2021-01-01,januari,2021
[DISINFORMASI] Sertifikasi Halal Dipegang PT Surveyor Indonesia Bukan Lagi MUI ,2021-01-01,januari,2021
[DISINFORMASI] Kandungan Zat BPA pada Galon Isi Ulang Berbahaya ,2021-01-01,januari,2021
[DISINFORMASI] Seekor Buaya Masuk ke Rumah Warga saat Banjir di Tanjung Pinang ,2021-01-01,januari,2021
[HOAKS] Warung Kopi Purnama Tutup karena Ada Kasus Covid-19 ,2021-01-01,januari,2021
[HOAKS] Link Subsidi Kuota Belajar 75 GB Berlaku hingga 10 Januari 2021 ,2021-01-01,januari,2021
"[HOAKS] Surabaya Kembali Zona Merah, RS Penuh dan Rencana Razia Masker ",2021-01-01,januari,2021
[HOAKS] Akun Palsu Mengatasnamakan Bupati Pasuruan Menawarkan Produk Asuransi ,2021-01-01,januari,2021
"[DISINFORMASI] Dikuasai PKI, Masjid Istiqlal Meniadakan Shalat Jumat ",2021-01-01,januari,2021
[DISINFORMASI] Brigjen Hendra Kurniawan Anak Kandung Presiden China Xi Jinping ,2021-01-01,januari,2021
[DISINFORMASI] Titik Api Diam Telah Terlihat di Merapi ,2021-01-01,januari,2021
[DISINFORMASI] Halte Berbentuk Palu Arit di Cileungsi ,2021-01-01,januari,2021
[HOAKS] Pesan Singkat Mengatasnamakan Kepala Dinas Kesehatan Kabupaten Purworejo ,2021-01-01,januari,2021
[HOAKS] Terkuak Isi Pidato Vladimir Putin yang Anti Islam ,2021-01-01,januari,2021
[HOAKS] Resep Campuran Teh Hijau dan Lemon untuk Atasi Covid-19 ,2021-01-01,januari,2021
[HOAKS] Penerima Vaksin Sinovac Pertama Meninggal Dunia ,2021-01-01,januari,2021
"[HOAKS] Lowongan Kerja PT Astra dengan Gaji Rp 5,2 Juta Per Bulan ",2021-01-01,januari,2021
[DISINFORMASI] Foto Korban Banjir di Batam ,2021-01-01,januari,2021
[DISINFORMASI] Video Menteri Yaqut Diusir ketika Hadir di Tanah Melayu Riau ,2021-01-01,januari,2021
[DISINFORMASI] Anggota Polri Disebut Polisi Cabang Tiongkok ,2021-01-01,januari,2021
[HOAKS] Pesan Singkat Mengatasnamakan Kepala Dinas Kesehatan Kabupaten Purworejo ,2021-01-01,januari,2021
[HOAKS] Terkuak Isi Pidato Vladimir Putin yang Anti Islam ,2021-01-01,januari,2021
[HOAKS] Resep Campuran Teh Hijau dan Lemon untuk Atasi Covid-19 ,2021-01-01,januari,2021
[HOAKS] Penerima Vaksin Sinovac Pertama Meninggal Dunia ,2021-01-01,januari,2021
"[HOAKS] Lowongan Kerja PT Astra dengan Gaji Rp 5,2 Juta Per Bulan ",2021-01-01,januari,2021
[DISINFORMASI] Foto Korban Banjir di Batam ,2021-01-01,januari,2021
[DISINFORMASI] Video Menteri Yaqut Diusir ketika Hadir di Tanah Melayu Riau ,2021-01-01,januari,2021
[DISINFORMASI] Anggota Polri Disebut Polisi Cabang Tiongkok ,2021-01-01,januari,2021
[DISINFORMASI] 2 Orang Tuna Wisma yang Ditemui Oleh Mensos Risma Saat Blusukan Hanya Settingan ,2021-01-01,januari,2021
[HOAKS] Tulisan Najwa Shihab Tentang Covid-19 ,2021-01-01,januari,2021
[HOAKS] Setengah dari Jumlah Penjaga Toko di BTC (Bangka Trade CentePositif Covid-19 ,2021-01-01,januari,2021
[HOAKS] Akun Facebook Mengatasnamakan Wakil Wali Kota Surabaya Terpilih ,2021-01-01,januari,2021
[HOAKS] Pemulung yang Ditemui Risma adalah Penjual Poster Di Jalan Minangkabau Manggarai ,2021-01-01,januari,2021
[HOAKS] Jawa dan Bali Lockdown pada 11-25 Januari 2021 ,2021-01-01,januari,2021
"[DISINFORMASI] Drone Tiongkok Masuk Perairan NKRI, Prabowo Sebut Tiongkok Negara Sahabat ",2021-01-01,januari,2021
[DISINFORMASI] Video Joget Risma dan Para Pejabat Tidak Memberlakukan Protokol Kesehatan ,2021-01-01,januari,2021
