judul,date,bulan,tahun
Surat Edaran Larangan Tempat Hiburan Malam (THMengatasnamakan Pemkot Makassar ,2020-08-01,agustus,2020
Video Data BIN Tetapkan Jakarta Zona Hitam Covid-19 ,2020-08-01,agustus,2020
Foto Habib Rizieq Promosikan Bentuk Salib ,2020-08-01,agustus,2020
Kecelakaan di Bendungan Jatigede Sumedang ,2020-08-01,agustus,2020
Muncul Virus Menular Baru di China Bernama Tick-Borne ,2020-08-01,agustus,2020
Lampu Bendera Lebanon Dinyalakan di Piramida Mesir ,2020-08-01,agustus,2020
"STO Telkom Pekanbaru Kebakaran, Perbaikan Layanan sampai 1 Bulan ",2020-08-01,agustus,2020
Jokowi Mundur Secara Terhormat Hari Ini ,2020-08-01,agustus,2020
MPR Sudah Tetapkan Presiden Jokowi Menjabat 8 Tahun ,2020-08-01,agustus,2020
Korban Ledakan Akibat Menyimpan Handphone di Dalam Jok Motor yang Membawa Bensin 1 Jerigen ,2020-08-01,agustus,2020
Video Pendaki Gunung Dimutilasi ,2020-08-01,agustus,2020
Foto Islam Nusantara Shalat Berlatar Belakang Salib ,2020-08-01,agustus,2020
Foto Kondisi Kadrun Terancam Mati Kelaparan Akibat Sepinya Job Demo ,2020-08-01,agustus,2020
"Arti Nama ""Jokowi"" dalam Bahasa China Tradisional ",2020-08-01,agustus,2020
Teknik Menyelamatkan Diri dari Kecelakaan Mobil ,2020-08-01,agustus,2020
Kantor Kecamatan Bogor Barat Ditutup Gara-gara Covid-19 ,2020-08-01,agustus,2020
Penyakit Legionnaires Dapat Tertular dari Masker ,2020-08-01,agustus,2020
Pesan Camat Se-DKI Berisi Imbauan Anies Baswedan Tunda Hajatan ,2020-08-01,agustus,2020
Foto Aa Gym Simpan Sepasang Simbol Mirip Salib Kembar ,2020-08-01,agustus,2020
Surat Pemberitahuan Jadwal Kegiatan Pemprov Jatim dengan PT Waskita Karya dan CV Patraindo Nusa Pertiwi  ,2020-08-01,agustus,2020
Akun Facebook Mengatasnamakan Penjabat Wali Kota Makassar Rudy Djamaluddin ,2020-08-01,agustus,2020
Jokowi akan Dibaptis dan Mengganti Nama Menjadi Hebartus ,2020-08-01,agustus,2020
Pengumuman Bantuan Sumbangan Mengatasnamakan MNC Peduli ,2020-08-01,agustus,2020
Instruksi Bupati Malang Izinkan Lomba Agustusan dan Kegiatan yang Datangkan Massa ,2020-08-01,agustus,2020
Video Viral PKL Menangis Mengaku Diancam Istri Wakapolda Sumatera Selatan ,2020-08-01,agustus,2020
Video Hantaman Rudal Israel dalam Ledakan di Beirut ,2020-08-01,agustus,2020
Presiden Joko Widodo Melatih Jan Ethes Lempar Tanggung Jawab ,2020-08-01,agustus,2020
Video Penghijauan di Pakistan yang Salah Jenis Pohonnya ,2020-08-01,agustus,2020
Vaksin Sinovac untuk Lawan Virus Corona Haram karena Belum Mendapat Label Halal dari MUI ,2020-08-01,agustus,2020
Foto Habib Rizieq Bersama Patung Kristus Penebus di Rio de Jeneiro ,2020-08-01,agustus,2020
Situs gurubcom Dimiliki dan Dikelola Kemendikbud ,2020-08-01,agustus,2020
Informasi Lowongan kerja Puskesmas Margadana ,2020-08-01,agustus,2020
"Akun Facebook Mengatasnamakan Wali Kota Payakumbuh, Riza Falepi ",2020-08-01,agustus,2020
Surat Tawaran Jalur Prioritas Kemitraan Mengatasnamakan UNS Surakarta ,2020-08-01,agustus,2020
Aplikasi TikTok Milik PKI ,2020-08-01,agustus,2020
Luhut Sebut Arak Bali Mampu Turunkan Angka Positif Covid-19 ,2020-08-01,agustus,2020
Foto Bulan dan Bintang Lambang Kemerdekaan Indonesia ke 75 ,2020-08-01,agustus,2020
Foto Wanita yang Sedang Divaksin adalah Putri Presiden Rusia Vladimir Putin ,2020-08-01,agustus,2020
Video Pesta Kembang Api Olimpiade 2020 di Gunung Fuji ,2020-08-01,agustus,2020
Ada Kawah Besar Akibat Ledakan di Beirut Lebanon ,2020-08-01,agustus,2020
Penarikan Denda oleh Satpol PP Kota Samarinda Sebesar Rp250 Ribu ,2020-08-01,agustus,2020
Penangguhan Sekolah Tatap Muka Tanggal 18 Agustus 2020 di Kota Sukabumi ,2020-08-01,agustus,2020
"Akun Facebook Mengatasnamakan Gubernur Sumatera Barat, Irwan Prayitno ",2020-08-01,agustus,2020
Grup WhatsApp Covid-19 Catut Nama WHO Cs ,2020-08-01,agustus,2020
Pengeroyokan oleh Pemotor di Flyover Kebayoran Lama ,2020-08-01,agustus,2020
Foto Anies Memanen Padi yang Masih Hijau ,2020-08-01,agustus,2020
Raja Bahrain Dikawal Robot Bersenjata ,2020-08-01,agustus,2020
Drone Mata-Mata Berbentuk Serangga yang didanai oleh Pemerintah Amerika Serikat dan Sudah Dalam Masa  ,2020-08-01,agustus,2020
Gowes Merah Putih 2020 Bersama Forkopimda Sumatera Barat pada 23 Agustus 2020 ,2020-08-01,agustus,2020
Surat Panggilan Interview PT Pertamina pada Tanggal 19 Agustus 2020 ,2020-08-01,agustus,2020
Air Kelapa Dicampur Jeruk Nipis dan Garam Manjur Menyembuhkan Penderita Covid-19 ,2020-08-01,agustus,2020
Video Rusia Jadi Pemenang Pembuatan Vaksin Covid-19 ,2020-08-01,agustus,2020
Penodongan di Jalan Poros Tebing Empat Lawang ,2020-08-01,agustus,2020
Rakyat Kecewa dengan Presiden Jokowi Pakai Pakaian Kaisar Tiongkok ,2020-08-01,agustus,2020
Ahmad Dhani Diusung dalam Pilkada Kota Pasuruan ,2020-08-01,agustus,2020
Anak SMP di Lombok Berubah Menjadi Seekor Anjing ,2020-08-01,agustus,2020
Din Syamsuddin Dapat Dana tak Terbatas dari Amerika dan Israel ,2020-08-01,agustus,2020
Uang Baru Pecahan Rp75 Ribu Tidak Dapat Dibelanjakan ,2020-08-01,agustus,2020
Baju Adat Tiongkok China Dalam Gambar Uang Pecahan R7000 ,2020-08-01,agustus,2020
Pendeta Anies Baswedan Sedang Berkhotbah ,2020-08-01,agustus,2020
Razia Masker Besar-besaran di DKI Jakarta 15-19 Agustus 2020 ,2020-08-01,agustus,2020
Foto Anies Baswedan Memegang Lem Kaleng ,2020-08-01,agustus,2020
Pengakuan Relawan Usai Suntik Vaksin Covid-19 jadi Lupa Punya Ut]ang dan Cenderung Plonga-Plongo ,2020-08-01,agustus,2020
MUI Tak Lagi Dilibatkan untuk Sertif]ikasi Produk Halal ,2020-08-01,agustus,2020
PT Pura Barutama Perusahaan yang Mendapat Orderan Mencetak Uang Baru ,2020-08-01,agustus,2020
"Akun Palsu Facebook Ketua Komisi III DPRD Pamekasan, Ismail ",2020-08-01,agustus,2020
Jokowi dan Sri Mulyani Akui Gagal Kelola Ekonomi ,2020-08-01,agustus,2020
Lambang Love pada Logo HUT RI Merupakan Simbol LGBT ,2020-08-01,agustus,2020
Foto Denny Siregar Dipajang di Belakang Truk ,2020-08-01,agustus,2020
Sandi Rahasia pada Uang Baru Pecahan Rp 7000 ,2020-08-01,agustus,2020
Rumah Sakit Cipto Mangunkusumo Mengibarkan Bendera Polandia ,2020-08-01,agustus,2020
Megawati Mau Mengubah Pancasila ,2020-08-01,agustus,2020
"Video Viral ""WARGA LEKOK GEMPAR SE EKOR KAMBING MELAHIRKAN ANAK BABI"" ",2020-08-01,agustus,2020
Pohon Natal pada Lambang Sumatera Barat ,2020-08-01,agustus,2020
Akun Facebook Mengatasnamakan Wakil DPRD Sulawesi Utara ,2020-08-01,agustus,2020
"Poster Habib Rizieq Dibakar, Seluruh Anggota FPI Kebal Bacok dan Kami Siap Perang ",2020-08-01,agustus,2020
KPK Gelar Lomba Petak Umpat Peringati HUT RI ke-75 ,2020-08-01,agustus,2020
Akun Mengatasnamakan Mantan Gubernur Kepri Meminjam Uang ,2020-08-01,agustus,2020
Penukaran Uang Pecahan Rp75 Ribu untuk Bayar Utang Negara ,2020-08-01,agustus,2020
Bahan Baku Uang Kertas Dollar Amerika dari Serat Pohon Pisang Abaka ,2020-08-01,agustus,2020
Video Pesta Kembang Api Merayakan Tahun Baru Islam 1442 Hijriah ,2020-08-01,agustus,2020
Video Kelompok Wanita Berhijab Injak Bendera Merah Putih Demi Konten TikTok ,2020-08-01,agustus,2020
Burj Khalifa Dihiasi Bendera Israel untuk Merayakan Perjanjian Damai Israel dan Uni Emirat Arab ,2020-08-01,agustus,2020
Foto Lelaki Menginjak Merah Putih ,2020-08-01,agustus,2020
Foto Korban Ledakan Lebanon Dimakamkan Berjemaah ,2020-08-01,agustus,2020
Prabowo Subianto Peringatkan Gatot Nurmantyo Jangan Bikin Kisruh Indonesia ,2020-08-01,agustus,2020
"Akun Facebook Wakil Ketua I DPRD Kota Parepare, Tasming Hamid (TS",2020-08-01,agustus,2020
Tagihan Biaya Asuransi Mengatasnamakan JNE ,2020-08-01,agustus,2020
TNI Siap Ambil Alih Kekuasaan karena Jokowi akan Dimakzulkan ,2020-08-01,agustus,2020
Putri Presiden Vladimir Putin Meninggal setelah Suntikan Kedua Vaksin Covid-19 ,2020-08-01,agustus,2020
Lukisan Tahun 1962 Ini Telah Ramalkan Kehidupan pada 2022 Usai Pandemi Covid-19 ,2020-08-01,agustus,2020
Negara Arab Merupakan Negara yang Paling Awal Mengakui Kemerdekaan RI ,2020-08-01,agustus,2020
Seorang Pria Buang Uang Rp 300 Juta di Jalan Raya ,2020-08-01,agustus,2020
"SMS Mengatasnamakan Pimpinan, Dosen dan Karyawan Universitas AMIKOM Yogyakarta ",2020-08-01,agustus,2020
Facebook Bagi-bagi Kuota Internet Gratis Bagi Para Penggunanya ,2020-08-01,agustus,2020
Virus Corona Covid-19 Dibuat di Lab Militer Partai Komunis China ,2020-08-01,agustus,2020
Mahasiswa Bayar Uang Pangkal di Undip Rp 87 Miliar ,2020-08-01,agustus,2020
Instruksi Kemen BUMN Angkat Advisor Gaji Rp 40 Juta ,2020-08-01,agustus,2020
Potret Presiden Jokowi Mengukur Baju Karya Desainer Ivan Gunawan  ,2020-08-01,agustus,2020
Jalan Layang Tol Cikampek Bergelombang Gara-Gara Digunakan Untuk Uji Coba Esemka Ribuan Unit ,2020-08-01,agustus,2020
Pesawat Jatuh di Tol Banyumanik ,2020-08-01,agustus,2020
Busana Jokowi Terinspirasi dari Cerita Fiksi ,2020-08-01,agustus,2020
Foto Uang 212 Bergambar Perempuan Bercadar ,2020-08-01,agustus,2020
Formulir Online Pendaftaran Kartu Indonesia Pintar ,2020-08-01,agustus,2020
Dokumen WHO Terkait Anjuran Tidak Menggunakan Masker Selama Pandemi Covid-19 ,2020-08-01,agustus,2020
Foto Para Pekerja China akan Melakukan Cuti ,2020-08-01,agustus,2020
35 Guru Meninggal Akibat Covid-19 di Surabaya ,2020-08-01,agustus,2020
Foto Sri Mulyani Berjilbab “Kode pilkada sudah dekat Atau tagihan sudah jatuh tempo” ,2020-08-01,agustus,2020
Puluhan Orang India Berjoget Merayakan Mendagri India Positif Covid-19 ,2020-08-01,agustus,2020
Pernyataan Jokowi Pertumbuhan Ekonomi Indonesia Terjun Bebas Tidak Diberi Utang Lagi ,2020-08-01,agustus,2020
Gaji Tambahan dari Jokowi Berupa Mata Uang Yen ,2020-08-01,agustus,2020
Makan Telur Rebus Tengah Malam Dapat Mencegah Covid-19 ,2020-08-01,agustus,2020
"Gedung Kejaksaan Terbakar, Menko Marves Luhut Minta 'Pemutihan' Sejumlah Koruptor ",2020-08-01,agustus,2020
Akun WhatsApp Mengatasnamakan Sekda Kabupaten Kepulauan Selayar ,2020-08-01,agustus,2020
Berkas - Arsip Perkara Hukum Hangus Dalam Kebakaran Gedung Kejaksaan Agung ,2020-08-01,agustus,2020
"Jokowi Sudah Gagal Dan Tidak Bisa Jadi Presiden Lagi, Jutaan Rakyat Akan Memaksa Angkat Kaki ",2020-08-01,agustus,2020
Foto Penampakan Tiga Orang yang Menggantung Anggota TNI di Pohon ,2020-08-01,agustus,2020
Minum Kopi Dengan Jeruk Nipis Dapat Meredakan Migrain ,2020-08-01,agustus,2020
"Demokrat: Habib Rizieq ada di Arab, kenapa tak dirikan khilafah di sana? Beraninya Cuma di Indonesia Saja,  ",2020-08-01,agustus,2020
Penggunaan Obat Trombolisis di RSPON Tidak Bisa Lebih dari 4 Jam Setelah Kejadian Stroke ,2020-08-01,agustus,2020
"Virus Corona Sengaja Disebar oleh Dokter, Tenaga Medis dan Apoteker ",2020-08-01,agustus,2020
Akun Twitter Tommy Soeharto ,2020-08-01,agustus,2020
Devils Tower Adalah Pohon Purba Raksasa ,2020-08-01,agustus,2020
Pernyataan Maruarar Sebut Orang yang Tak Pilih Jokowi Bodoh dan Gila ,2020-08-01,agustus,2020
Kebakaran Gedung Kejaksaan Agung Pemutihan Perkara ,2020-08-01,agustus,2020
Foto Penampakan Sosok Berbaju Putih di Gedung Kejaksaan Agung yang Terbakar ,2020-08-01,agustus,2020
Anies Batalkan Pemasangan Masker di Patung Jendral Sudirman karena Dianggap Tidak Waras oleh Warga ,2020-08-01,agustus,2020
Video Makanan Asli dan Palsu Buatan China ,2020-08-01,agustus,2020
Vietcong Belajar Taktik Gerilya dari Indonesia ,2020-08-01,agustus,2020
CCTV Kejagung Ikut Terbakar Hangus ,2020-08-01,agustus,2020
Video Bayi Bermata Tiga ,2020-08-01,agustus,2020
Ustadz Yusuf Mansur Meninggal Dunia ,2020-08-01,agustus,2020
Masker Wajah Menyebabkan Infeksi Staph ,2020-08-01,agustus,2020
Akun Facebook Mengatasnamakan Walikota Jakarta Selatan ,2020-08-01,agustus,2020
Gempa Besar dan Tsunami di Sumba Timur pada 28 Agustus 2020 ,2020-08-01,agustus,2020
Akun WhatsApp Mengatasnamakan Kades di Pamekasan Tawarkan Lelang Mobil ,2020-08-01,agustus,2020
Gedung KPK Terbakar ,2020-08-01,agustus,2020
Sepucuk Senjata Mengarah ke Presiden Joko Widodo saat Memimpin Upacara 17 Agustus 2020 ,2020-08-01,agustus,2020
Robot Damkar Tidak Digunakan saat Kebakaran Gedung Kejagung karena sedang Diisolasi akibat Covid-19 ,2020-08-01,agustus,2020
Ketua PBNU Kyai Said Aqil Siroj Jual Tanah Masjid untuk Gedung Seminari ,2020-08-01,agustus,2020
Tommy Soeharto Sebut Jokowi Tak Punya Prestasi di Bidang Pertanian ,2020-08-01,agustus,2020
Heri Amalindo bukan Putra Daerah Kabupaten PALI ,2020-08-01,agustus,2020
RUU Omnibus Law telah Disahkan ,2020-08-01,agustus,2020
Thermo Gun Merusak Kelenjar Pineal ,2020-08-01,agustus,2020
Akun Facebook Mengatasnamakan Kepala Dinas Pendidikan dan Kebudayaan Kabupaten Kotawaringin Barat ,2020-08-01,agustus,2020
Tiga Waktu yang Dilarang untuk Mandi ,2020-08-01,agustus,2020
Surat Panggilan Calon Karyawan PT Pertamina DIY dan Surakarta ,2020-08-01,agustus,2020
Ahok Ancam Bubarkan Pertamina jika 7 Bulan Tak Untung ,2020-08-01,agustus,2020
Tak Ada Media yang Memberitakan Demonstrasi Menolak RUU Omnibus Law ,2020-08-01,agustus,2020
Foto Jokowi Pingsan Butuh Nafas Buatan ,2020-08-01,agustus,2020
Vaksin Covid-19 Menyebabkan Mandul ,2020-08-01,agustus,2020
Foto Gereja Sepi karena Ditinggal Jemaatnya ,2020-08-01,agustus,2020
"Janji Gatot Nurmantyo bila Jadi Presiden, Akan Gaji Rp5 Juta per-Jiwa ",2020-08-01,agustus,2020
Razia Masker di Kabupaten dan Kota Magelang ,2020-08-01,agustus,2020
Samsung Bagi-bagi Ponsel untuk Belajar saat Pandemi Covid-19 ,2020-08-01,agustus,2020
Foto Kebobrokan Indonesia yang Harus Ditutupi ,2020-08-01,agustus,2020
Rencana Ibu Kota Pindah karena Jakarta Banyak Dihuni FPI dan Habaib ,2020-08-01,agustus,2020
Video Pengibaran Bendera Kalimat Tauhid di Poso ,2020-08-01,agustus,2020
Jokowi dan Prabowo Bicara tentang Rakyat yang Tenggelam ,2020-08-01,agustus,2020
Drama Korea My Secret Terrius Ramalkan Covid-19 ,2020-08-01,agustus,2020
Penanaman Microchip ke Tubuh Penduduk Dunia lewat Vaksin Covid-19 ,2020-08-01,agustus,2020
Materai Dinaikkan Menjadi Rp 1000 karena Nilai Rupiah Tidak Mungkin Menyentuh Rp 1000 ,2020-08-01,agustus,2020
Kartun The Simpsons Ramal Kematian Donald Trump pada 27 Agustus 2020 ,2020-08-01,agustus,2020
Foto Bendera Tauhid Berkibar di Surabaya pada Tahun 1935 ,2020-08-01,agustus,2020
Daftar Wilayah 200 Orang Positif Covid-19 di Purworejo pada 25 Agustus 2020 ,2020-08-01,agustus,2020
Kebakaran Gedung Kejagung karena Tikus Gigit Kabel Listrik ,2020-08-01,agustus,2020
Akun Facebook Wali Kota Malang Sutiaji Berjualan Pulsa ,2020-08-01,agustus,2020
Pemberian Bantuan Covid-19 Mengatasnamakan Bank BRI ,2020-08-01,agustus,2020
Banser di Gereja Membawa Pulang Nasi Tumpeng ,2020-08-01,agustus,2020
Sosok Malaikat di antara Jemaah Masjid Nabawi ,2020-08-01,agustus,2020
Seorang Banser Stres dan Meninggal Akibat Sering Diejek Menjaga Gereja dan Membubarkan Pengajian ,2020-08-01,agustus,2020
Pesan SMS Mengatasnamakan Rektor Universitas Jenderal Soedirman (Unsoe,2020-08-01,agustus,2020
Polda Metro Jaya Bakal Gelar Razia Masker Serentak di Jabodetabek ,2020-08-01,agustus,2020
Indosat Luncurkan Paket Kuota Belajar 10 GB Seharga 10 Rupiah ,2020-08-01,agustus,2020
Hukuman Masuk Peti Mati karena Tidak Pakai Masker ,2020-08-01,agustus,2020
Foto Orang Sedang Menggendong Tuyul di Bekas Bangunan Terbakar ,2020-08-01,agustus,2020
Dirut Bank Syariah di NTB Poligami Kakak-Adik ,2020-08-01,agustus,2020
Kewajiban Menggunakan Masker Bisa Menyebabkan Masalah Bau Mulut ,2020-08-01,agustus,2020
Razia Masker dengan Denda Rp 25000 di Kabupaten dan Kota Bandung ,2020-08-01,agustus,2020
Surat Undangan Mengatasnamakan LKPP ,2020-08-01,agustus,2020
IGD RS Fatmawati Tak Terima Pasien karena Banyak Petugas Terpapar Covid-19 ,2020-08-01,agustus,2020
Gus Ali Pengasuh Ponpes Bumi Sholawat Meninggal ,2020-08-01,agustus,2020
Kisah Azab Kematian Tragis Mustafa Kemal ,2020-08-01,agustus,2020
"“Ahok Tidak Akan Dicopot, Erick Thohir : Kami Punya Kepentingan Dengan Cina, Mohon Dipaham” ",2020-08-01,agustus,2020
Video Wali Kota Surabaya Risma Dibaptis ,2020-08-01,agustus,2020
Tak Ada Lagi yang Minta Salaman dan Selfie ke Presiden Jokowi karena Rakyat Muak dan Jijik ,2020-08-01,agustus,2020
Mengkonsumsi Soda Kue Dapat Meningkatkan Stamina,2020-08-01,agustus,2020
Foto Anies Baswedan Pakai Konde,2020-08-01,agustus,2020
Dua Orang Sipit Diangkat Menjadi Dewan Penasehat Densus 88 dan Mabes Polri,2020-08-01,agustus,2020
"Foto Jokowi dengan Latar Belakang Tulisan ""Karya Terbaik Pemerintah adalah Hutang""",2020-08-01,agustus,2020
Kabupaten Pekalongan Zona Hitam Covid-19,2020-08-01,agustus,2020
Info Lowongan Kerja Puskesmas Wates,2020-08-01,agustus,2020
Foto suasana Pembukaan Jembatan Golden Gate Tahun 1937,2020-08-01,agustus,2020
Potret Foto Kecelakaan Bus di KM 76 Tol Cikopo,2020-08-01,agustus,2020
Ritual Pemuja Setan dari Sekte di Kampus ITENAS,2020-08-01,agustus,2020
PKI Telah Melancarkan Aksinya,2020-08-01,agustus,2020
FPA Siap Dukung Jokowi dengan Syarat Semua Laskar Harus Diangkat Menjadi PNS,2020-08-01,agustus,2020
Video Siswa Secapa TNI AD Membantah Positif Covid-19,2020-08-01,agustus,2020
Protes Keras Seorang Laki-laki Kepada RSU Mitra Medika Medan,2020-08-01,agustus,2020
Panggilan Tes Interview PT PLN pada Tanggal 25-26 Juli 2020 di Yogyakarta,2020-08-01,agustus,2020
Jokowi Tegaskan Tes Corona Harus Berbayar Untuk Gaji Buzzer,2020-08-01,agustus,2020
Tito Karnavian Sebut Jenazah Covid-19 Harus Dibakar,2020-08-01,agustus,2020
Indonesia Jadi Kelinci Percobaan Vaksin Covid-19 dari China,2020-08-01,agustus,2020
Jokowi Sebut Virus Corona Bisa Masuk Melalui Handphone,2020-08-01,agustus,2020
Kalung Eucalyptus Disebut Jimat Virus Corona,2020-08-01,agustus,2020
Gambar Dewa Anubis pada Logo Truk “Covid-19 Mobile Testing Faculty”,2020-08-01,agustus,2020
Peta Yogyakarta di Timur Tengah,2020-08-01,agustus,2020
COVID-19 Adalah Kombinasi SARS dan AIDS,2020-08-01,agustus,2020
Joyce Meyer Membagikan Uang di Tengah Pandemi Covid 19,2020-08-01,agustus,2020
Gibran Rakabuming Kutip Ayat Agama Lain,2020-08-01,agustus,2020
Mark Zuckerberg akan Tutup Facebook di Indonesia karena Dibully Netizen,2020-08-01,agustus,2020
Foto Nelayan dan Ikan Jumbonya Ini Berasal dari Tahun 1900,2020-08-01,agustus,2020
Denda Tilang pada Struk Jalan Tol Jombang-Mojokerto,2020-08-01,agustus,2020
Video Shalat Subuh Berjamaah Semenjak Hagia Sophia Dibuka,2020-08-01,agustus,2020
Para Camat di Kabupaten Cilacap Mendapatkan Fasilitas Pesawat Terbang,2020-08-01,agustus,2020
Mal Citos Cilandak Rawan Covid-19,2020-08-01,agustus,2020
Separuh Pegawai LPEI di SCBD Positif Covid-19,2020-08-01,agustus,2020
"Soal Tuduhan Jokowi Anti Islam, Luhut: Umur 10 Tahun Beliau Sudah Hafal Alquran 40 Juz",2020-09-01,september,2020
Pertamina Bagi-bagi Cek Tunai Rp150 Juta Lewat SMS,2020-09-01,september,2020
Semua Pembicaraan Pemilik KTP-el Disadap Komunis Tiongkok,2020-09-01,september,2020
Wakil Presiden AS Minta Umat Muslim yang Tuntut Hukum Syariah Tinggalkan Amerika,2020-09-01,september,2020
Adly Fairuz Cucu Wakil Presiden Ma'ruf Amin,2020-09-01,september,2020
Perdagangan Seks Melalui Pesan Teks di Negeri Paman Sam,2020-09-01,september,2020
Nyamuk Rekayasa Genetika untuk Lawan Virus Corona,2020-09-01,september,2020
"Akun Facebook Mengatasnamakan Wakil Bupati (WabuBogor, Iwan Setiawan",2020-09-01,september,2020
SK Rekom PDIP untuk Pilwali Kota Surabaya,2020-09-01,september,2020
Video Komplek Perumahan Angker dan Rawan Rampok,2020-09-01,september,2020
Nama Indonesia Berasal dari Akronim Inisial Wali Songo,2020-09-01,september,2020
Akun Facebook Mengatasnamakan Bupati Purbalingga,2020-09-01,september,2020
Soimah Give Away,2020-09-01,september,2020
Pertamina Rugi 11 Triliun karena Ahok Jadi Komisaris Utama,2020-09-01,september,2020
"Resmikan Tol di Aceh, Denny: Udah Berganti Presiden, Baru Jokowi yang MampLantas Presiden Sebelum  nya, ",2020-09-01,september,2020
Daun Kemangi dapat Mengobati Gatal si Kulit,2020-09-01,september,2020
"Jokowi Berharap, Kita Semua Dapat Menerima Kehadiran TKA Cina sebagai Saudara Yang Mencari Nafkah  Disini",2020-09-01,september,2020
Himbauan Walikota Jakarta Selatan Terkait Razia Siswa di Tempat Keramaian,2020-09-01,september,2020
Politikus PKS Netty Prasetiyani Meninggal Dunia,2020-09-01,september,2020
Pabrik Mobil Esemka di China,2020-09-01,september,2020
Nomor WhatsApp Mengatasnamakan Wali Kota Tangerang,2020-09-01,september,2020
Terapi Pijat Telinga Untuk Anak yang Terlambat Berbicara,2020-09-01,september,2020
BP2MI berikan santunan Kepada TKW/TKI UEA Sebesar AE30 Ribu Dirham,2020-09-01,september,2020
Password Wifi Gratis di Jakarta adalah AniesKeren,2020-09-01,september,2020
Akun Palsu Mengatasnamakan Jasa Pencairan BLT BPJS Ketenagakerjaan,2020-09-01,september,2020
Cilandak Barat Ditetapkan sebagai Klaster Zona Merah Baru Covid-19,2020-09-01,september,2020
Perdana Menteri Jepang Mundur Terkait Virus Corona,2020-09-01,september,2020
Gara-gara Kecanduan Game Seorang Anak Mengamuk dan Membunuh Orang di Rumahnya Terjadi di Prancis,2020-09-01,september,2020
Kanker Getah Bening Bisa Sembuh dengan Minum Air Rebusan Pepaya Muda,2020-09-01,september,2020
"Bima Arya, Gelar Razia GDS, Siswa Yang Terjaring Diberi Sanksi Menyemprot Lingkungan Dengan Radius 1000  ",2020-09-01,september,2020
Facebook Indonesian Hoaxes Milik Mafindo Adalah Buzzer Cebong,2020-09-01,september,2020
Pesan Berantai Pengembalian Dana Tambahan BST (Bantuan Sosial Tuna,2020-09-01,september,2020
Denda 250 Ribu Bagi Warga Tak Bermasker di Surabaya,2020-09-01,september,2020
"Akun WhatsApp Mengatasnamakan Walikota Kediri, Abdullah Abu Bakar Meminta Sumbangan",2020-09-01,september,2020
Lowongan Kerja Puskesmas Kedungkandang,2020-09-01,september,2020
Beredar Pesan Razia Anak-anak yang Keliaran Malam di Kota Sukabumi,2020-09-01,september,2020
Wakil Presiden KH Ma'ruf Amin Mengatakan Presiden Joko Widodo Jago Menipu Rakyat,2020-09-01,september,2020
Varian Baru Indomie Rasa Boba Milk Tea,2020-09-01,september,2020
Foto Yosi Mokalu Mengenakan Kaos Bertuliskan “BADAN ARAHAN BUZZERP ISTANA”,2020-09-01,september,2020
Ada Pawai Tim Hendi Sepanjang Tugu Muda Menuju Tempat Pendaftaran Pilkada 2020,2020-09-01,september,2020
Video Kecelakaan Maut Dua Siswi di Kebonpolo Magelang,2020-09-01,september,2020
Pegowes Meninggal di Banguntapan,2020-09-01,september,2020
Ahok Dipecat karena Pertamina Rugi Rp 11 Triliun,2020-09-01,september,2020
Perusak Polsek Ciracas adalah Polisi Sendiri,2020-09-01,september,2020
Pemberian Hadiah Mengatasnamakan PT Len Industri (Perser,2020-09-01,september,2020
Pemerintah Zaman Jokowi Pekerjakan Buzzer,2020-09-01,september,2020
Info Lowongan Pekerjaan Pemandi Jenazah RSUD Pasar Rebo,2020-09-01,september,2020
Menag Belajar Mengaji Dengan Abu Janda,2020-09-01,september,2020
"Corona adalah Permainan Dajjal, Jangan Ikuti Protokol Covid-19 karena Memakai Masker Merupakan  ",2020-09-01,september,2020
PDIP Buka Opsi Bubarkan MUI Demi Utuhnya Pancasila,2020-09-01,september,2020
Babi di Murakarta Jelmaan Gadis di Sebuah Desa,2020-09-01,september,2020
Mencuci Hidung Bisa Mengubah Hasil Swab Covid-19,2020-09-01,september,2020
Rocky Gerung Mendadak Ustad,2020-09-01,september,2020
Kopi Mampu Tangkal Covid-19,2020-09-01,september,2020
Informasi Razia Keliling Wali Kota Medan dan Satgas Covid-19,2020-09-01,september,2020
Percakapan WhatsApp Kades Pranan Sukoharjo Meminta Pulsa,2020-09-01,september,2020
Rest Area KM 19 Tol Jakarta - Cikampek Di Jual,2020-09-01,september,2020
Tentara Merah RRC Berkamuflase Jadi Banser dan Ansor,2020-09-01,september,2020
Demo Penolakan Lockdown Covid-19 di London,2020-09-01,september,2020
Ridwan Saidi Menerima Penghargaan dari Presiden Joko Widodo,2020-09-01,september,2020
Sistem Ganjil Genap Ditiadakan Mulai Senin Selama PSBB,2020-09-01,september,2020
Artikel Berjudul “Gli Italiani Chiamano Anies Baswedan Troppo Stupido Come Il Governatore di Jakarta”,2020-09-01,september,2020
Akun WhatsApp Mengatasnamakan Sekda Palembang Ratu Dewa,2020-09-01,september,2020
Ustaz Abdul Somad Sebut Facebook Haram,2020-09-01,september,2020
Tank Tiongkok Lindas Demonstran Hongkong,2020-09-01,september,2020
Korban Luka Akibat Bentrokan di Ciledug,2020-09-01,september,2020
Chadwick Boseman Tewas Dibunuh dengan Racun,2020-09-01,september,2020
Angka Perceraian Melonjak Drastis selama Pandemi Covid-19,2020-09-01,september,2020
Semua Penduduk Indonesia akan Dipajaki,2020-09-01,september,2020
Promosi Data Internet 100 GB Tanpa Isi Ulang Tokopedia,2020-09-01,september,2020
Cina Bangun Pangkalan Militer di Indonesia,2020-09-01,september,2020
Penyebab Datangnya Corona ke Indonesia karena Habib Rizieq Tidak Boleh Pulang,2020-09-01,september,2020
Pendisiplinan Siswa di Kabupaten Tanahbumbu Kalimantan Selatan,2020-09-01,september,2020
Lambang NU Rezim Now,2020-09-01,september,2020
Jokowi Menjadi Aktor Film Mortal Combat,2020-09-01,september,2020
Sekolah Dasar Negeri Cebongan 01 JKolam Kodok N32,2020-09-01,september,2020
Satu RW di Citeureup Diisolasi,2020-09-01,september,2020
Jokowi Perintahkan TNI Awasi Warga karena Takut Dilengserkan,2020-09-01,september,2020
Seluruh Bendera dan Atribut PDIP Dilarang Dipasang di Sumatera Barat,2020-09-01,september,2020
Akun Palsu Haji Martinus Bakal Calon Walikota Banjarbaru,2020-09-01,september,2020
Surat Menteri PANRB Terkait Penerimaan Catar Poltekip dan Poltekim,2020-09-01,september,2020
Tenaga Medis Terpapar Covid-19 di Puskesmas Baamang 1,2020-09-01,september,2020
Kabar PDIP Bubar Kader Pindah PSI,2020-09-01,september,2020
Meningkatkan Peluang Hamil dengan Mengkonsumsi Buah Zuriat,2020-09-01,september,2020
Instagram Membatasi Hanya 10% Pengikut yang Bisa Melihat Postingan,2020-09-01,september,2020
Lebah Tidak Bisa Terbang,2020-09-01,september,2020
Video Tes Menahan Napas untuk Membantu Analisa Covid-19,2020-09-01,september,2020
Penampakan Mobil Ghoib Esemka,2020-09-01,september,2020
Harimau Kurus Tidak Diberi Makan di Kebun Binatang Maharani Lamongan,2020-09-01,september,2020
Video Demo Covid-19 di Polandia yang Tuntut Pandemi Diakhiri,2020-09-01,september,2020
Peta Kota Bandung Nyaris Zona Hitam,2020-09-01,september,2020
Peneliti Australia Sebut Jokowi sebagai Presiden Tanpa Kemampuan,2020-09-01,september,2020
Foto Penampakan Badan Setelah Tersambar Petir,2020-09-01,september,2020
Foto Presiden Jokowi Masuk Peti Mati,2020-09-01,september,2020
