judul,date,bulan,tahun
"Artikel Berjudul “Nama Muhammad dan Ali Dilarang Terbang, Kebijakan Imigrasi Bukti ",2020-01-01,januari,2020
Makan Kangkung Bikin Ngantuk ,2020-01-01,januari,2020
Transaksi Jual Mobil Atas Nama Kapolres Sampang ,2020-01-01,januari,2020
Transportasi Baru Pengganti Busway Ketika Jakarta Banjir ,2020-01-01,januari,2020
Ular Salju Mematikan ,2020-01-01,januari,2020
Presiden Sedang Menghina Rakyatnya Sendiri ,2020-01-01,januari,2020
BMKG Melarang Masyarakat Rayakan Malam Tahun Baru di Pantai ,2020-01-01,januari,2020
Seorang Pria di Garut Menginjak Al Quran ,2020-01-01,januari,2020
Tom Cruise Mau Jadi Presiden 2020 ,2020-01-01,januari,2020
Kecelakaan di Jalur Cikidang ,2020-01-01,januari,2020
4 Penari Tari Umbul di Sumedang Meninggal Dunia ,2020-01-01,januari,2020
China Mampu Buat Kain Tembus Pandang Buat Kamuflase Saat Perang ,2020-01-01,januari,2020
Rumah Tina Toon Terendam Banjir ,2020-01-01,januari,2020
#BanjirJakarta4niesDimana BMW hanyut mengikuti sunatullah ,2020-01-01,januari,2020
"Foto “Tak Diliput Media, Begini Kondisi Anies Saat Tangani Banjir Jakarta” ",2020-01-01,januari,2020
Foto Burung Terkecil di Dunia ,2020-01-01,januari,2020
Ada Buaya di Kampung Melayu ,2020-01-01,januari,2020
Foto Surabaya Dikepung Banjir ,2020-01-01,januari,2020
Foto Anies Selfie di Tengah Warga Jakarta Yang Kebanjiran ,2020-01-01,januari,2020
Titip Surat Mengatasnamakan BKN ,2020-01-01,januari,2020
Rumah Hotman Paris Kebanjiran ,2020-01-01,januari,2020
SCP 169 Hewan Raksasa Purba yang Ukurannya Lebih Besar dari Apapun di Dunia ,2020-01-01,januari,2020
Banjir Bandang di Obyek Wisata Guci ,2020-01-01,januari,2020
Ustaz Yusuf Mansur Tertawakan Anies yang Sedang Inspeksi Banjir Jakarta ,2020-01-01,januari,2020
"Tiap Malam Makan Mie Instan, Mahasiswa Meninggal ",2020-01-01,januari,2020
Jokowi : Lebih Mudah Mengatasi Banjir Jika Saya Presiden Kalau Gubernurnya Ahok ,2020-01-01,januari,2020
Megawati Minta Jokowi Segera Cari Pengganti KH Ma'ruf Amin ,2020-01-01,januari,2020
Penangkapan Ular Sanca di Pejaten Barat Jakarta Selatan Saat Banjir ,2020-01-01,januari,2020
Ketua Umum PBNU Said Aqil Beragama Hindu ,2020-01-01,januari,2020
Pemberitahuan Siaga Banjir Bendungan Bili - bili Mengatasnamakan Bupati Gowa ,2020-01-01,januari,2020
Kandungan Thimerosal dalam Vaksin Sebabkan Autisme ,2020-01-01,januari,2020
Judul Berita Tempo yang Memuat MUI Larang Bermain Terompet dan Kembang Api ,2020-01-01,januari,2020
Anomali Hujan Deras Saat Bulan Purnama 10-15 Januari 2020 ,2020-01-01,januari,2020
Media Lebay Memberitakan Banjir Jakarta ,2020-01-01,januari,2020
Princess Qajar Simbol Kecantikan Yang Bikin 13 Pria Bunuh Diri ,2020-01-01,januari,2020
Foto Anies Baswedan Membaca Buku “PEDOMAN MENATA KATA” ,2020-01-01,januari,2020
Gudang Tokopedia Terendam Banjir ,2020-01-01,januari,2020
Penyiksaan Muslim Uyghur ,2020-01-01,januari,2020
Anies Potong Anggaran Banjir Demi Formula E ,2020-01-01,januari,2020
"Tulisan Akbar Tandjung Tentang Luhut Binsar Pandjaitan ""Luhut Itu Menteri Indonesia ",2020-01-01,januari,2020
Pengambilan SK 100% Di BKD Masing-Masing Instansi Pada 17 Januari 2020 ,2020-01-01,januari,2020
Dokter Minta Wapres Ma’ruf Amin Beristirahat ,2020-01-01,januari,2020
Debby Maulana Dilaporkan Hilang ,2020-01-01,januari,2020
Banjir Bandang di Cipanas Puncak ,2020-01-01,januari,2020
Pelayan Antar Dimsum Pakai Perahu Saat Banjir ,2020-01-01,januari,2020
Kista Bisa Hilang Setelah Melahirkan ,2020-01-01,januari,2020
"Sekretaris Camat Purwakarta, Wawan Ihwani Meminjam Uang ",2020-01-01,januari,2020
Dirut KAI Cek Banjir Naik Getek Berkursi ,2020-01-01,januari,2020
Lowongan Kerja PT Inalum ,2020-01-01,januari,2020
Rekrutmen Mengatasnamakan PT PELNI (Perser,2020-01-01,januari,2020
Panggilan Interview PGaruda Indonesia Pada Tanggal 7 Januari 2020 ,2020-01-01,januari,2020
Apakah Ozzy Osbourne Di Ranjang Kematiannya ,2020-01-01,januari,2020
Kecelakaan Mobil Parah Akibat Ranjau Paku Pada Buah Jeruk ,2020-01-01,januari,2020
Jakarta akan Dilanda Banjir Lagi pada Akhir Januari atau Awal Februari 2020 ,2020-01-01,januari,2020
Video Longsor Susulan Di Sukajaya Hari Ini 6 Januari 2020 ,2020-01-01,januari,2020
Longsor Di Pertambangan Pasir Sumedang ,2020-01-01,januari,2020
Video Do’a Dari Anak-anak Muslim Uighur ,2020-01-01,januari,2020
"Banjir Bandang di Tayu, Kabupaten Pati, Jawa Tengah ",2020-01-01,januari,2020
Ada Korban Jiwa Ulah Begal di Batu 7 Tanjungpinang ,2020-01-01,januari,2020
Video Penampakan Tol Laut Pertama di Indonesia ,2020-01-01,januari,2020
Akun Facebook Mengatasnamakan Jarot Winarno Bupati Sintang ,2020-01-01,januari,2020
Anggota Brimob Tewas Akibat Ditembak KKB di Kabupaten Intan Jaya ,2020-01-01,januari,2020
Kebakaran Australia dari Luar Angkasa ,2020-01-01,januari,2020
Puan Maharani: Nasib Anak dan Menantu Jokowi Ada di Ibu Saya ,2020-01-01,januari,2020
Pemasukan TikTok Digunakan untuk Mendirikan Kamp Konsentrasi Muslim Uighur China ,2020-01-01,januari,2020
Longsor Susulan di Cigudeg ,2020-01-01,januari,2020
Anggota Polisi Mendiamkan Korban Kecelakaan ,2020-01-01,januari,2020
Penemuan Sabu di Dalam Nanas Oleh BNN dan Mabes Polri ,2020-01-01,januari,2020
Ibu Hamil Terjepit Shuttle Bus Bandara Soetta Hingga Pingsan ,2020-01-01,januari,2020
Menghilangkan Tahi Lalat Dengan Kapur Sirih dan Sabun Colek ,2020-01-01,januari,2020
SMS Pemenang Shopee New Year And Sale ,2020-01-01,januari,2020
Surat panggilan Tes Calon Karyawan PPertamina Pada Tanggal 09 Januari 2020 ,2020-01-01,januari,2020
Bantuan Hukum KBRI London Untuk Pemulangan Reynhard ,2020-01-01,januari,2020
Anggota BANSER di kudus jawa tengah di keroyok sama emak-emak penjual nasi uduk ,2020-01-01,januari,2020
Proyek Kereta Cepat Kebanggaan Presiden Jokowi dari Hasil Utang ke China Roboh ,2020-01-01,januari,2020
Penampakan Video Drone Yang Diklaim Sebagai Serangan Dari USA Terhadap Jenderal ,2020-01-01,januari,2020
Video Angin Puting Beliung di Klaten ,2020-01-01,januari,2020
"Video Tanah Bergerak Terjadi di Ciniru, Kuningan ",2020-01-01,januari,2020
Video Wanita Berbikini di Tengah Banjir Jatinegara ,2020-01-01,januari,2020
Pesan Berantai Dua Laki-laki Memakai Baju Lambang Pancasila Menipu dan ,2020-01-01,januari,2020
"Isu Tsunami di Kabupaten Kayong Utara, Ketapan",2020-01-01,januari,2020
Dr Ahmed Gozali Dari Irak Mendo'akan Korban Banjir Di Jakarta ,2020-01-01,januari,2020
Snack Berbahaya Dibuat di Israel ,2020-01-01,januari,2020
Warga Garut Jadi Korban Pembegalan di Kawasan Jalan Patriot ,2020-01-01,januari,2020
Anggota Dishub Disebut Cari-cari Kesalahan Sopir Truk ,2020-01-01,januari,2020
Tujuh Pernyataan Ekstrem Pak Menkes ,2020-01-01,januari,2020
Malaysia Diam-diam Geser Patok Perbatasan saat Indonesia-China Memanas ,2020-01-01,januari,2020
"Kunjungi Lokasi Banjir Bogor, Hujan Lokal Hanya Mengguyur Tubuh Jokowi ? ",2020-01-01,januari,2020
China Telah Membangun Pangkalan Militer di Natuna ,2020-01-01,januari,2020
Video Banjir Bandang di Citatah Padalarang ,2020-01-01,januari,2020
Video Bencana Banjir Bendung Wilalung ,2020-01-01,januari,2020
Akun Facebook Mengatasnamakan Gland Kowaas Camat Kecamatan Paal II ,2020-01-01,januari,2020
Pesan Berantai Berisi Biaya Tilang Terbaru di Indonesia dan Pemberian Hadiah untuk ,2020-01-01,januari,2020
Fauzi Baadila Meninggal ,2020-01-01,januari,2020
Surat Panggilan Tes Seleksi PAngkasa Pura Pada 11 Januari 2020 ,2020-01-01,januari,2020
Panggilan Tes Seleksi Calon Karyawan PT Pertamina ,2020-01-01,januari,2020
"Foto Musim Dingin Anak-Anak di Gaza, Palestina ",2020-01-01,januari,2020
Jokowi Terbitkan PP No 30/2019 Anies Akan Dipecat ,2020-01-01,januari,2020
Menag Fachrul Ingin Bahasa China Menjadi Syarat Kelulusan Siswa Madrasah Aliyah ,2020-01-01,januari,2020
KPK Gagal Geledah Kantor DPP PDIP ,2020-01-01,januari,2020
Video Amatir Angin Puting Beliung di Madiun ,2020-01-01,januari,2020
"Pemerintah Iran Hargai Kepala Donald Trump Rp 1,1 Triliun ",2020-01-01,januari,2020
Data Bahan Paparan Menko PMK Terkait Penanganan Banjir ,2020-01-01,januari,2020
Akun Instagram Mengatasnamakan Pelatih Persebaya Surabaya Aji Santoso ,2020-01-01,januari,2020
Pesan WhatsApp Kadis Perikanan Pandeglang Pinjam Uang ,2020-01-01,januari,2020
Zona Megathrust di Selat Makassar ,2020-01-01,januari,2020
SMS Pemenang Undian Hadiah PPertamina (Perser,2020-01-01,januari,2020
"Jokowi Sebut China Hanya Mengejar Ikan yang Lari ke Indonesia Melalui Natuna, Jadi ",2020-01-01,januari,2020
Tanggul Laut Jebol di Kamal Muara ,2020-01-01,januari,2020
Hasil Buruan Singa Iran Pada Serigala AS ,2020-01-01,januari,2020
"Video ""Puting Beliung Di Ciniru Kuningan Jawa Barat"" ",2020-01-01,januari,2020
PT Taspen Bagi-Bagi Deviden dan Tabungan Hari Tua Ke Pensiunan PNS ,2020-01-01,januari,2020
Panggilan Tes Calon Karyawan PT Bursa Efek Indonesia ,2020-01-01,januari,2020
Open Recruitment Pertamina Tanggal 21 Januari 2020 ,2020-01-01,januari,2020
"Banjir Bandang Dahsyat dan Longsor Mengakibatkan Jalan Putus di Tanggamus, ",2020-01-01,januari,2020
Akun Sekretaris Provinsi Kaltim Rusmadi Wongso Meminta Pertemanan dan Nomor ,2020-01-01,januari,2020
Foto-foto Akibat Serangan yang Terjadi ke Pangkalan Ain Al-Asad Anbar Pada Januari ,2020-01-01,januari,2020
Video Angin Monsun di Parepare ,2020-01-01,januari,2020
Bendungan Jatiluhur Kirim Banjir ke Bekasi ,2020-01-01,januari,2020
Kebijakan Baru LTMPT dan Ristekdikti ,2020-01-01,januari,2020
Info Jalur Masuk UI Tanpa Tes Bagi Hafiz Quran ,2020-01-01,januari,2020
Promo Kupon Big Meal KFC Melalui Pesan Berantai di WhatsApp ,2020-01-01,januari,2020
Jembatan Soekarno-Hatta di Kota Malang Melengkung ,2020-01-01,januari,2020
Uji Coba Tilang e-CCTV di Kota Salatiga Mulai Tanggal 13 Januari 2020 ,2020-01-01,januari,2020
Video Penangkapan Penculikan Anak Dalam Karung di Bekasi ,2020-01-01,januari,2020
Sekjen PDIP Hasto Kristiyanto Menangis Saat Didatangi Penyidik KPK ,2020-01-01,januari,2020
Forum Umat Islam Bima Sebut Pura Sebagai Tempat Najis ,2020-01-01,januari,2020
"Jalan Daan Mogot Ambles ""Anies Sempat Mengatakan Jakarta Beruntung Tidak Ada ",2020-01-01,januari,2020
Surat Perintah BNPB Terkait Normalisasi Sungai di Sulawesi Tenggara ,2020-01-01,januari,2020
Mantan Komisioner KPU Wahyu Setiawan Adalah Keturunan PKI ,2020-01-01,januari,2020
Penipuan Mengatasnamakan LinkAja Indonesia ,2020-01-01,januari,2020
Megawati Menyuap Ketua KPU Arief Budiman 2 Triliyun ,2020-01-01,januari,2020
Foto Al-Quran Dibakar di China ,2020-01-01,januari,2020
"Video ""Pekerja China Tertimbun Longsor"" ",2020-01-01,januari,2020
Penculikan Anak di Desa Kranji Paciran Lamongan ,2020-01-01,januari,2020
Ikan Naik ke Permukaan di Gorontalo Pertanda Gempa ,2020-01-01,januari,2020
Stok Rudal Indonesia Menuju Natuna ,2020-01-01,januari,2020
Komisioner KPU Wahyu Setiawan: Hasil Pilkada 2020 Sudah Ditentukan Sebelum ,2020-01-01,januari,2020
"Berita Kompas: Pasca-Kunjungan Jokowi di Natuna, Kapal Ikan Asing Semakin ",2020-01-01,januari,2020
Foto Anak Dikutuk Jadi Domba Berkepala Anjing ,2020-01-01,januari,2020
Mulai 1 Februari 2020 Imigrasi Daerah Aruk Sambas dan Imigrasi Daerah Badau Tidak ,2020-01-01,januari,2020
Megawati sedang Membusukkan Nama KPU untuk Membongkar Ijazah Palsu Jokowi ,2020-01-01,januari,2020
Uji Coba Tilang e-CCTV Tanggal 20 Januari 2020 di Jalanan Pasar Payakumbuh ,2020-01-01,januari,2020
Mantan Direktur Keuangan Jiwasraya Hary Prasetyo Kabur ke London ,2020-01-01,januari,2020
Jembatan Kembar Gowa Bergeser dan Akan Roboh ,2020-01-01,januari,2020
“Halal Park” Bandara Soekarno Hatta Hanya Diperuntukkan Bagi Muslim ,2020-01-01,januari,2020
"Pesan Ali Ngabalin ke Anies: Kerja, Jangan Menghayal jadi Presiden, cuihh!! ",2020-01-01,januari,2020
Bunga Ini Mekar hanya Saat Adzan Dikumandangkan ,2020-01-01,januari,2020
Rumah Ibadah Masjid Tidak Ada di Kecamatan Pakem ,2020-01-01,januari,2020
Restoran Larang Driver Ojol Masuk ,2020-01-01,januari,2020
Ketinggian Air di Bendungan Bili-Bili Melewati Angka Normal ,2020-01-01,januari,2020
Akun Facebook Mengatasnamakan Wakil Ketua Komisi B DPRD Jatim ,2020-01-01,januari,2020
"CNN Indonesia ""Banjir di Jakarta adalah Air Mata Malaikat yang Terharu pada Alumni ",2020-01-01,januari,2020
"Pemilik Mobil yang Terseret Banjir di Kota Ashkelon Israel, Masuk ke Dalam Penggugat ",2020-01-01,januari,2020
Penculikan Anak di Kecamatan Seruyan Tengah ,2020-01-01,januari,2020
Simpatisan PDIP Untuk Demo di Balai Kota ,2020-01-01,januari,2020
Wapres Kaget Aliran Uang Jiwasraya Masuk ke Dana Kampanye Jokowi-Ma’ruf ,2020-01-01,januari,2020
Beli Es Cendol Pakai Pecahan Genteng ,2020-01-01,januari,2020
Bupati Boven Digoel Tewas Usai Berzinah ,2020-01-01,januari,2020
"Raja Agung Sejagad: yang Plonga Plongo Bisa Jadi Pemimpin, Masa Saya Ndak Boleh ",2020-01-01,januari,2020
Pengusiran Tunanetra di Wyata Guna Bandung ,2020-01-01,januari,2020
Foto Misil Iran yang Disiapkan Setelah Pemimpin Militernya Dibunuh Amerika ,2020-01-01,januari,2020
Megawati Imbau Kasus Wahyu Setiawan Tidak Perlu Dilanjutkan ,2020-01-01,januari,2020
Video Ikan Berhamburan di Waduk Wadaslintang Kebumen ,2020-01-01,januari,2020
Cara Menghindari Denda Saat E-toll Hilang ,2020-01-01,januari,2020
Surat Panggilan Seleksi Calon Karyawan PT Pertamina Hulu Energi ,2020-01-01,januari,2020
Akun Facebook Mengatasnamakan Wakil Bupati Kabupaten Halmahera Selatan ,2020-01-01,januari,2020
Penculikan Anak di Bangil Pasuruan Jawa Timur ,2020-01-01,januari,2020
Moeldoko: Kekalahan Telak Jokowi karena Isu Agama Tak Terbendung ,2020-01-01,januari,2020
China Claim Reynhard Sinaga Adalah Warga Negara China ,2020-01-01,januari,2020
Penculikan Anak di Kupang ,2020-01-01,januari,2020
Video Serangan Puluhan Roket dan Rudal Iran Ke Basis Militer Amerika Serikat ,2020-01-01,januari,2020
Spanduk Pro Jokowi ,2020-01-01,januari,2020
Mahfud MD Sebut Tepuk Islam Yes Kafir No Menyakitkan ,2020-01-01,januari,2020
Tambahan Pelat Besi untuk Mengurangi Isi Gas dalam Tabung ,2020-01-01,januari,2020
Video Kepala Korban Begal Putus di Sepatan ,2020-01-01,januari,2020
Rieke Diah Pitaloka Minta Presiden Jokowi Mundur ,2020-01-01,januari,2020
Surat Pengangkatan Honorer Jadi PNS Mengatasnamakan Kementerian PANRB ,2020-01-01,januari,2020
Siswa SDN 02 Pagi Kebon Jeruk Diminta Beli Buku Paket ,2020-01-01,januari,2020
Surat Pemberitahuan Pemadaman Listrik Wilayah Pondok Gede tgl 17 & 18 Januari 2020 ,2020-01-01,januari,2020
Pesan Whatsapp Mengatasnamakan Kepala Suku Dinas Perhubungan Jakarta Barat ,2020-01-01,januari,2020
Barack Obama Mengumumkan Niat Untuk Mencalonkan Diri sebagai Presiden Kenya ,2020-01-01,januari,2020
Seorang Pria Bersenjata Api Menodong Pengendara Mobil di Brebes ,2020-01-01,januari,2020
UPI Menjadi Lokasi Sunda Empire ,2020-01-01,januari,2020
"Penculikan Anak di Kuranji, Kota Padang ",2020-01-01,januari,2020
MK Mengakui Adanya Kecurangan Pilpres tapi Hakim MK Memenangkan ,2020-01-01,januari,2020
Krim Analgesik Digunakan untuk Bakar Lemak Wajah ,2020-01-01,januari,2020
Surat Panggilan Tes Seleksi PAngkasa Pura (PerserPada Tanggal 20 Januari 2020 ,2020-01-01,januari,2020
Percobaan Penculikan Anak pada Tanggal 15 Januari 2020 di Jember ,2020-01-01,januari,2020
Bunglon Berkamuflase Mengikuti Objek yang Ditempati ,2020-01-01,januari,2020
Viral Video Pohon Bambu Berbuah di Pamekasan ,2020-01-01,januari,2020
Gubernur Edy Rahmayadi Musnahkan Babi di Sumatera Utara ,2020-01-01,januari,2020
KPK Janji Geledah DPP PDIP setelah Dapat Izin dari Megawati ,2020-01-01,januari,2020
Sinyal Internet Dimatikan di Seluruh Indonesia dan Semua Aktifitas di Media Sosial ,2020-01-01,januari,2020
Penculikan Anak dengan Modus Berpakaian Badut di Banjarbaru ,2020-01-01,januari,2020
Pemerintah Kota Palu akan Hapus Kelurahan Petobo ,2020-01-01,januari,2020
Marzuki Alie Dihubungi oleh Pihak yang Mengatasnamakan Perusahaan Kaesang ,2020-01-01,januari,2020
Lelang Online Mengatasnamakan PT Pegadaian (Perser,2020-01-01,januari,2020
"Kinerja Buruk, Jokowi Akan Pecat Anies ",2020-01-01,januari,2020
Merokok Di Kabin Mobil Dapat Merusak AC ,2020-01-01,januari,2020
Toa Khusus Untuk Yang Seiman ,2020-01-01,januari,2020
Driver Ojol di Bekasi Tak Punya Handphone dan Menawarkan Order Dengan Cara ,2020-01-01,januari,2020
Boba Tidak Bisa Dicerna dan Masuk Empedu ,2020-01-01,januari,2020
Kanibal Kabur ke Baubau Sulawesi Tenggara ,2020-01-01,januari,2020
"Tak Diundang ke Sebuah Acara Baksos, Anies Numpang Tenar dan Muka Tembok ",2020-01-01,januari,2020
Tahun 2020 Kebun Raya Cibodas Dikontrakkan Ke Pihak Asing & Tiket Masuk Naik ,2020-01-01,januari,2020
000 ,2020-01-01,januari,2020
Pegawai Dishub Kota Bekasi Palak Supir Menggunakan Golok di Pulo Gadung ,2020-01-01,januari,2020
Undangan Acara Diklat Keuangan dan Perpajakan Nasional Mengatasnamakan PKN ,2020-01-01,januari,2020
Foto-foto Pembantaian Unta Pasca Kebakaran Hutan di Australia ,2020-01-01,januari,2020
Pejabat Kominfo Kepergok Bersetubuh Dalam Mobil di Sebuah Mall ,2020-01-01,januari,2020
Monas Bukan Untuk RTH tapi Untuk Formula E ,2020-01-01,januari,2020
Email Berisi Surat Panggilan Tes Calon Karyawan PAngkasa Pura II (Perser,2020-01-01,januari,2020
Waspada Foto Pelaku Penculik Anak ,2020-01-01,januari,2020
Info Jadwal Razia STNK di Batam ,2020-01-01,januari,2020
Penculikan Anak SD di Kudus ,2020-01-01,januari,2020
Uji Coba Tilang e-CCTV di Jalanan Pare Mulai Awal Februari 2020 ,2020-01-01,januari,2020
Foto Rumah Sakit Jiwa yang Terbengkalai ,2020-01-01,januari,2020
Anies Baswedan Dinobatkan sebagai Gubernur Terbaik di Dunia ,2020-01-01,januari,2020
Video Penjual Cilok Dilabrak Orang Tua Pacar karena Beda Status ,2020-01-01,januari,2020
Pelajar yang Bunuh Begal Didakwa Hukuman Seumur Hidup ,2020-01-01,januari,2020
Jenis Suara Sirene Ambulans Memiliki Fungsi yang Berbeda-beda ,2020-01-01,januari,2020
Foto Korban Begal di Sowak Simpur ,2020-01-01,januari,2020
Ada Virus Berbahaya di RSUP DSardjito ,2020-01-01,januari,2020
Ibu Muda Rela Dinikahi Siapa Saja yang Biayai Pengobatan Anaknya di RSUD Jombang ,2020-01-01,januari,2020
"Wardah Mensponsori Kegiatan ""Bahaya Feminisme dan LGBT"" ",2020-01-01,januari,2020
Pelaku Perampok di Warteg Pesanggrahan Telah Tertangkap ,2020-01-01,januari,2020
MUI Keluarkan Fatwa Haram kepada Netflix ,2020-01-01,januari,2020
Siring Gunakan Dana Desa Tahun 2019 ,2020-01-01,januari,2020
Kebakaran di SPBU Selaganggeng ,2020-01-01,januari,2020
Festival Makan Durian Gratis Bersama Pemprov Banten ,2020-01-01,januari,2020
Wanita Tewas Membeku Gara-gara Tidur Malam Pakai Kipas Angin ,2020-01-01,januari,2020
Naik Motor Bonceng Anak di bawah Umur Akan Didenda Rp3 juta ,2020-01-01,januari,2020
Bantuan Air PDAM Malang Diambil dari Air Sungai ,2020-01-01,januari,2020
Penculikan Anak di Pasangkayu ,2020-01-01,januari,2020
Surat Undangan Rakor Penetapan Calon Penerima & Penandatanganan Perjanjian ,2020-01-01,januari,2020
Penerapan E-Tilang di Banjarbaru dan Bangkalan ,2020-01-01,januari,2020
"Tilang e-CCTV di Simpang 4 Lampu Merah SMPN 1, Masjid Agung dan Bank Kalteng ",2020-01-01,januari,2020
Virus Corona Diduga Sudah Menyebar dan Masuk ke Indonesia di Gedung BRI 2 ,2020-01-01,januari,2020
Spanduk Tolak Mengurusi Jenazah Pendukung Pembangunan Gereja di Pondok Jagung ,2020-01-01,januari,2020
Jurus Omnibus Law Jokowi Hapuskan Kewajiban Sertifikasi Halal ,2020-01-01,januari,2020
Menteri Tito Bisa Memecat Anies karena Merevitalisasi Monas Tanpa Izin ,2020-01-01,januari,2020
Akun Palsu Di Facebook Mengaku Sebagai Anggota Polri di Polres Kepahiang ,2020-01-01,januari,2020
Email Palsu Mengatasnamakan Ditjen Pajak ,2020-01-01,januari,2020
Informasi Terkait PDSS Mengatasnamakan Humas PTN dan Panitia LTMPT ,2020-01-01,januari,2020
Informasi Jasa Pembuatan SIM Resmi Kepolisian dengan Daftar Harganya ,2020-01-01,januari,2020
Himbauan Kemenkes RI Tentang Merebaknya Virus Influenza ,2020-01-01,januari,2020
Penculikan Anak di Cibinong Kabupaten Bogor ,2020-01-01,januari,2020
Video Gus Dur Dibaptis ,2020-01-01,januari,2020
Menteri Yasonna Akhirnya Mundur usai Di Demo Warga Tanjung Priok ,2020-01-01,januari,2020
Promo Flash Sale Mengatasnamakan PT Gree Electric Appliances Indonesia ,2020-01-01,januari,2020
Surat Undangan Rapat Koordinasi Mengatasnamakan Kemenkop dan UKM ,2020-01-01,januari,2020
"Nadiem Makarim Sebut NEM, IPK, dan Ranking Tak Berpengaruh pada Kesuksesan ",2020-01-01,januari,2020
Kepanikan luar biasa orang2 china akibat #VirusCorona ,2020-01-01,januari,2020
Virus Hepatitis di Bantaeng Karena Penjual Makanan ,2020-01-01,januari,2020
Aksi Pemalakan terhadap Sopir Truk di Sidoarjo ,2020-01-01,januari,2020
"Virus Corona Sudah Masuk di Jakarta, 1 Pasien di RSPI Sulianti Saroso Jakarta Sedang ",2020-01-01,januari,2020
Orang Terinfeksi Virus Corona Di Rumah Sakit Wahidin Makassar ,2020-01-01,januari,2020
"Baru Datang dari Malaysia, Seorang Pasien Meninggal Mendadak Diduga Terkena Virus ",2020-01-01,januari,2020
Ular Cobra Raksasa Keluar dari Air Sungai ,2020-01-01,januari,2020
Pasien Corona di RSUD Dr Moewardi Solo ,2020-01-01,januari,2020
Virus Corona Dapat Dicegah dengan Rutin Minum Air Putih dan Menjaga Tengggorokan ,2020-01-01,januari,2020
Sup Kelelawar Penyebab Virus Corona ,2020-01-01,januari,2020
Surat Panggilan Test Calon Karyawan PPertamina (Perserpada 28 Januari 2020 ,2020-01-01,januari,2020
Pasien Umur 7 Bulan Meninggal karena Virus Corona di RSUD DSoetomo ,2020-01-01,januari,2020
WNA Asal China Terserang Corona di RSU Dr Soetomo Surabaya ,2020-01-01,januari,2020
Viral Video Detik-detik Helikopter Kobe Bryant Jatuh dan Meledak ,2020-01-01,januari,2020
Vaksin Virus Corona Sudah Ada Dan Dikembangkan Sebelumnya ,2020-01-01,januari,2020
Penyembuhan Virus Corona dengan Bawang Putih ,2020-01-01,januari,2020
HP Xiaomi Buatan China Dapat Menularkan Virus Corona ,2020-01-01,januari,2020
Korban Meninggal Terkena Virus Korona di Singapura ,2020-01-01,januari,2020
Virus Korona Sengaja Disebarkan Rezim Tiongkok untuk Membasmi Umat Islam di ,2020-01-01,januari,2020
Beras Plastik Telah Beredar di Kota Ambon ,2020-01-01,januari,2020
"Hanya Butuh Setahun, Anies Jamin Udara di Jakarta Sama seperti di Puncak ",2020-01-01,januari,2020
Pasien Terjangkit Virus Corona Di RSHS Bandung ,2020-01-01,januari,2020
Penumpang Meninggal Karena Virus Corona di Terminal 3 Bandara Soekarno Hatta ,2020-01-01,januari,2020
Habis Semua Dimakan Pak Jokowi Termasuk Tikus ,2020-01-01,januari,2020
Video Spesies Cacing di Kaleng ,2020-01-01,januari,2020
Virus Corona Telah Masuk di Palembang ,2020-01-01,januari,2020
Korban Meninggal di Wuhan Akibat Virus Corona Mencapai Sepuluh Ribu Orang ,2020-01-01,januari,2020
Polsek Tampan Panam Telah Menemukan 40 Motor di Tempat Penadah ,2020-01-01,januari,2020
Pasien Terjangkit Virus Corona di RSUD Tarakan ,2020-01-01,januari,2020
Jokowi: Virus corona minum bodrex 5 menit langsung sembuh ,2020-01-01,januari,2020
Foto Mayat Bergelimpangan di Jalanan Kota Wuhan yang Disebut Korban Virus Corona ,2020-01-01,januari,2020
"Diduga Terjangkit Virus Corona, Satu Pasien RS Doris Sylvanus Diisolasi ",2020-01-01,januari,2020
Seorang Pasien Terpapar Virus Corona di RS Siloam Jember ,2020-01-01,januari,2020
"Sabotase Gorong-gorong ditumpuki Pasir di Sepanjang Jalan Kramat Raya, Jakarta ",2020-01-01,januari,2020
Tidak Diizinkan Pulang Petugas Transjakarta Ditemukan Tewas ,2020-01-01,januari,2020
Tiga Orang TKA China PIWIP Meninggal Dunia Akibat Virus Corona ,2020-01-01,januari,2020
Video Detik-detik Warga Terkena Virus Corona Di Pusat Perbelanjaan Lombok ,2020-01-01,januari,2020
Virus Corona Menyerang Shah Alam Selangor ,2020-01-01,januari,2020
Pasien di RSUD Zainoel Abidin Banda Aceh Positif Terkena Virus Corona ,2020-01-01,januari,2020
RKanujoso Balikpapan Menerima Pasien Positif Corona ,2020-01-01,januari,2020
Seorang Warga di Depok Diisolasi karena Diduga Terinfeksi Virus Corona ,2020-01-01,januari,2020
Korban Penculikan di SMP 6 Bengkulu Jantungnya Hilang ,2020-01-01,januari,2020
Virus Corona Pertama Kali Ditemukan di Arab Saudi ,2020-01-01,januari,2020
Presiden China Umumkan Virus Corona Sudah Jadi Epidemi dan Memohon Doa Umat ,2020-01-01,januari,2020
Virus Corona Merupakan Senjata Biologis yang Bocor dari Laboratorium Wuhan ,2020-01-01,januari,2020
CHINA Baru Saja Bangun Rumah Sakit 57 Lantai ,2020-01-01,januari,2020
Virus Corona Wuhan Adalah Hasil Perkawinan Virus Kelelawar dan Virus Babi ,2020-01-01,januari,2020
Virus Corona Diduga Bermunculan di Pasar Wuhan yang Menjual Aneka Satwa Liar ,2020-01-01,januari,2020
Surat Ajakan Debat Terbuka Yang Diadakan Pengurus Cabang Muhammadiyah Jember ,2020-01-01,januari,2020
Kabar Adanya Pasien Positif Corona di RS Columbia Asia Medan Bersumber dari Pro,2020-01-01,januari,2020
Umat Islam Diintimidasi dan Dilarang Beribadah OLeh Laskar Kristen ,2020-01-01,januari,2020
Donasi Imtihan Santri Wisuda Tahfidz dari Pesantren Yatim Al Hilal Mencatut Nama dan ,2020-01-01,januari,2020
Kitab Iqro Sudah Lama Memprediksi Terjadinya Virus Corona ,2020-01-01,januari,2020
Kakek Buta di Sentul Disebut Pengemis Modus Perampokan ,2020-01-01,januari,2020
Mushola di Minahasa Utara dirusak oleh Sekelompok Orang ,2020-01-01,januari,2020
Penyerangan Terhadap Sopir Bus di Kalimantan ,2020-01-01,januari,2020
Pembunuhan Anak SMPN 6 Cirebon Diambil Ginjalnya ,2020-01-01,januari,2020
Warga Bantul Meninggal Dunia Digigit Anjing Rabies ,2020-01-01,januari,2020
Berjilbab Bikin Rambut Mudah Rontok ,2020-01-01,januari,2020
Penculikan Anak SD di Tanjung Selor ,2020-02-01,februari,2020
Warga Jombang Terkena Virus Corona ,2020-02-01,februari,2020
Pasien Virus Corona Sudah Masuk di RSUD Rabain Muara Enim ,2020-02-01,februari,2020
Nadiem Makarim Bayar 6 Triliun Rupiah Untuk Jadi Mendikbud ,2020-02-01,februari,2020
Passing Grade Universitas Indonesia ,2020-02-01,februari,2020
Virus Corona Bisa Menular Lewat Game Free Fire ,2020-02-01,februari,2020
"Bakso Daging Tikus di Pilangkenceng, Kabupaten Madiun ",2020-02-01,februari,2020
Mahasiswa Indonesia di Wuhan Tidak Boleh Keluar Kamar ,2020-02-01,februari,2020
Pasien Positif Suspek Virus Corona di Singkawang ,2020-02-01,februari,2020
