judul,date,bulan,tahun
Wapres Kita Berdosa Jika Melihat Tetangga Kelaparan Tapi Pemimpin Tidak Berdosa Kalau  ,2020-05-01,mei,2020
Aamir Khan Mendonasikan 1 kg Tepung dan 15000 Rupee Kepada Warga yang Membutuhkan  ,2020-05-01,mei,2020
Baru Sekali Ini Seorang Gubernur Mendapat Kunjungan 40 Duta Besar ,2020-05-01,mei,2020
Video Prosedur Pengangkatan Dahak Pasien Covid-19 dengan Ventilator ,2020-05-01,mei,2020
Semua Pemilik Rekening BRI Mendapat Bantuan Sosial Corona Sebesar Rp 600 Ribu ,2020-05-01,mei,2020
Penangkapan Seorang Maling Berkepala Anjing di Cawas Klaten ,2020-05-01,mei,2020
Ambulans Buang Jenazah Ke Semak Belukar ,2020-05-01,mei,2020
Tenaga Medis di RS dGL Tobing di-PHK ,2020-05-01,mei,2020
Kuota Gratis dari Pemerintah sebagai Insentif saat Pandemi Covid-19 ,2020-05-01,mei,2020
Tilang Masker yang Diadakan Polres Banggai pada Tanggal 4 Mei 2020 ,2020-05-01,mei,2020
Produk Rokok HM Sampoerna Ekspedisi Tanggal 25 Maret - 30 April 2020 Akan Ditarik untuk  ,2020-05-01,mei,2020
TKA China Datang ke Indonesia Bawa Amunisi Saat Wabah Corona Merebak ,2020-05-01,mei,2020
Video Seorang Kyai di Banten Menolak untuk Disuntik dengan Dalih Ketahanan Tubuh ,2020-05-01,mei,2020
"Perampokan di Jalan Ness, Kecamatan Jambi Luar Kota ",2020-05-01,mei,2020
Bintang Tsuraya Penanda Wabah Akan Usai ,2020-05-01,mei,2020
Video “Hati'' yg suka mkn tlOrang cina bunuh orang tuh plan tapi pasti” ,2020-05-01,mei,2020
Tiga Warga Jombang Jadi Korban Gendam Sales Obat ,2020-05-01,mei,2020
Foto Jokowi Berpidato Mengenakan Kemeja Berlogo Palu Arit ,2020-05-01,mei,2020
Pedagang Pentol Positif Corona di Kobar ,2020-05-01,mei,2020
Kandui Arah Banjarmasin Ditutup ,2020-05-01,mei,2020
Video Seorang Ibu dan Dua Anaknya Gantung Diri di Ujung Jaya Sumedang ,2020-05-01,mei,2020
Video Monyet Berenang di Hotel Efek Bali Lockdown ,2020-05-01,mei,2020
Gula Merah Palsu Banyumas ,2020-05-01,mei,2020
"Video Pembegalan di JIkan Gurame, Perak Barat ",2020-05-01,mei,2020
Ormas Sweeping Warung Makan di Ciamis Saat Bulan Puasa ,2020-05-01,mei,2020
Penampakan Hantu Terekam CCTV di RS Covid-19 Pulau Galang ,2020-05-01,mei,2020
Amerika Tanamkan Chip 666 ke Tubuh Warganya di Tengah Pandemi Covid-19 ,2020-05-01,mei,2020
67 Karyawan Indogrosir Yogyakarta Positif Virus Corona ,2020-05-01,mei,2020
"Jika TKA China Ditolak Masuk Ke Indonesia, Internet Indonesia Akan Diblokir ",2020-05-01,mei,2020
Pembebasan 800 Napi Lapas Paledang Bogor dan Lapas Pondok Rajeg Cibinong ,2020-05-01,mei,2020
Informasi Pembagian Masker Dicampur Bius ,2020-05-01,mei,2020
Keluar Rumah Tidak Memakai Masker Denda 5 Juta ,2020-05-01,mei,2020
Foto Tatacara Semayam Jenazah Didi Kempot (Dionisius PrasetyTidak Dikafani ,2020-05-01,mei,2020
Perawat Pasien Corona di Sumatera Utara Tak Digaji dan Diusir ,2020-05-01,mei,2020
Daftar Titik Penutupan Jalan Saat PSBB di Cirebon ,2020-05-01,mei,2020
Infografis yang Membandingkan Lambang Negara RRT dengan Logo Surat Presiden RI ,2020-05-01,mei,2020
Jokowi : “Hukuman Seumur Hidup Bagi Kepala Daerah Mainkan Bantuan Covid-19” ,2020-05-01,mei,2020
Tenaga Medis Covid-19 RSUD Purworejo Ditagih Biaya 150 Ribu Permalam oleh Pemkab  ,2020-05-01,mei,2020
Foto Jalan Dumai ke Sungai Pakning Dipagar ,2020-05-01,mei,2020
Pertamina Jual BBM Premium ke Industri Lebih Murah Dibandingkan ke Masyarakat ,2020-05-01,mei,2020
Indonesia akan Luncurkan Program 1 Suami 2 Istri ,2020-05-01,mei,2020
Akun Polres Magelang Ikut Live Instagram Balap Liar ,2020-05-01,mei,2020
Asteroid Akan Tabrak Bumi pada 8 Mei 2020 ,2020-05-01,mei,2020
Taman Raya Tahap V Masuk Zona Merah Covid-19 ,2020-05-01,mei,2020
Email Kemenkes Berisi Informasi Spesifik (Status COVID-19 And,2020-05-01,mei,2020
Akun Instagram Mengatasanamakan Kredivo Indonesia ,2020-05-01,mei,2020
Video Makhluk Misterius Muncul di Langit Arab Saudi ,2020-05-01,mei,2020
Penjualan Akun Prakerja Senilai 3 Juta ,2020-05-01,mei,2020
Jokowi akan Pecat Mereka yang Mempersulit WN Tiongkok Masuk Indonesia ,2020-05-01,mei,2020
Satu Keluarga di 16 Kota Jambi Terpapar Virus Corona ,2020-05-01,mei,2020
Perampokan di Pancasan Bogor Selatan yang Menyandera Korbannya ,2020-05-01,mei,2020
"Warga Dibolehkan Mudik Oleh Kemenhub, Aturannya Keluar Kemarin Sore ",2020-05-01,mei,2020
Pemerintah Putuskan Tidak Larang Mudik Lebaran ,2020-05-01,mei,2020
Pesan Berantai Penyebaran Pelaku Perampokan dari Luar Kota yang Disebar di Wilayah  ,2020-05-01,mei,2020
Satgas Covid-19 Kabupaten Pangkep Semprot Jemaah Shalat Tarawih di Masjid ,2020-05-01,mei,2020
Pedagang Pasar Krisna Positif Corona ,2020-05-01,mei,2020
Crop Circle Berlogo Microsoft Windows dan Virus Corona ,2020-05-01,mei,2020
Video Meteor Jatuh di Surabaya ,2020-05-01,mei,2020
Gubernur Ganjar Bilang Menonton Video Porno sambil Masturbasi Nikmat ,2020-05-01,mei,2020
"Jangan Terkecoh dengan Erick Thohir yang Dikira Pribumi Muslim, Ia Berfoto dengan Ibunya,  ",2020-05-01,mei,2020
Video “Anak kucing diinjak Kejadian di Selangor Malaysia” ,2020-05-01,mei,2020
Cara Ganti Background Facebook dengan Foto Sendiri ,2020-05-01,mei,2020
Foto Perempuan Tangannya Buntung Akibat Dijambret di Kiaracondong ,2020-05-01,mei,2020
Seorang Kakek di Tulungagung Meninggal karena Covid-19 ,2020-05-01,mei,2020
"Klaim Video ""Plandemic"" Terkait Virus Corona ",2020-05-01,mei,2020
PSBB Malang Raya Berlangsung 8 Mei 2020-22 Mei 2020 ,2020-05-01,mei,2020
Pasien Corona Kabur dari RSU Soetomo ,2020-05-01,mei,2020
Sri Mulyani: Pemerintah Pusat Tidak Memiliki Uang Untuk Membayar Utang Ke Pemprov DKI  ,2020-05-01,mei,2020
Covid-19 Sengaja Dimasukkan ke Tubuh Masyarakat Lewat Rapid Test ,2020-05-01,mei,2020
Bupati Konawe Akui Disuap Menko Luhut ,2020-05-01,mei,2020
Penculikan Secara Halus Kyai di Windusari dengan Memvonis Positif Corona ,2020-05-01,mei,2020
"Foto dengan Keterangan FPI Membubarkan Diri, Ingin Bergabung Menjadi Warga NU ",2020-05-01,mei,2020
Doa Kebangsaan untuk Solidaritas Sosial Disertai Amanah Presiden Joko Widodo dan  ,2020-05-01,mei,2020
PLN Sengaja Menambahkan Jumlah Tagihan ,2020-05-01,mei,2020
Surat Undangan Koordinasi Verifikasi Pengajuan Anggaran Prioritas Program Pembangunan  di ,2020-05-01,mei,2020
Poster Tahapan Pilkada Terbaru ,2020-05-01,mei,2020
Donasi Bahan Iftar dan Sahur di Masa Wabah Covid-19 oleh PKS ,2020-05-01,mei,2020
Polisi AS Sebut Kematian Seorang Peneliti Terkait Riset Covid-19 ,2020-05-01,mei,2020
Pasien Covid-19 Mengamuk Di RSUD Pamekasan ,2020-05-01,mei,2020
"Kutuk Kapal China Pembuang ABK, GP Ansor akan Kirim Angkatan Laut Banser ",2020-05-01,mei,2020
Video Siaran Langsung Penampakan Tornado Hancurkan Arab Saudi ,2020-05-01,mei,2020
Himbauan Simulasi di Manokwari ,2020-05-01,mei,2020
Edaran Poin-poin Aturan Warga Denpasar Saat Pembatasan Non-PSBB ,2020-05-01,mei,2020
Hacker Masuk WhatsApp Menempatkan Video Seks/Porno ,2020-05-01,mei,2020
Warga Positif Covid-19 Kabur di Cilegon ,2020-05-01,mei,2020
Sinetron Bajaj Bajuri Ramal Virus Corona 17 Tahun Lalu ,2020-05-01,mei,2020
Informasi 22 Pedagang Positif Rapid Test di Jambi ,2020-05-01,mei,2020
Denda Rp 300 Ribu Bagi Pengendara Tak Gunakan Masker di Semarang ,2020-05-01,mei,2020
Vaksin Pertama Kali Dibuat di Bawah kekhalifahan Ottoman pada Tahun 1717 ,2020-05-01,mei,2020
"Konspirasi Komunis, Yahudi dan Nasrani Manfaatkan COVID-19 untuk Menghancurkan Islam ",2020-05-01,mei,2020
Warga MB Ketapang Sudah Diperbolehkan Shalat Jumat dan Tarawih di Masjid ,2020-05-01,mei,2020
Pembukaan Tenaga Sukarelawan Penanganan Covid-19 RSUD Soetomo Surabaya ,2020-05-01,mei,2020
4 Ton Telur Bansos Pemprov Jabar Membusuk ,2020-05-01,mei,2020
Informasi 136 Anggota Polisi Positif Covid-19 dan 6 Meninggal ,2020-05-01,mei,2020
Ratusan Hasil Rapid Test di Pasar Karombasan Reaktif Covid-19 ,2020-05-01,mei,2020
Blokade Jalan di Kota Malang Mulai 13 Mei 2020 ,2020-05-01,mei,2020
"Video ""Ibu ini cuma dapat bantuan beras 1 liter dan mie instan 2 bungkus untuk 4 bulan"" ",2020-05-01,mei,2020
Pesan Berantai Mengenai Kejahatan Pembegalan di Tanah Mas Kota Semarang ,2020-05-01,mei,2020
Warga Meranti Positif Covid-19 ,2020-05-01,mei,2020
Foto Interior Lab Darurat COVID-19 Labkesda DKI Hasil Mencomot ,2020-05-01,mei,2020
Potret Keramaian di Pusat Perbelanjaan pada Saat PSBB di Jakarta ,2020-05-01,mei,2020
Saran Jack Ma Semoga Kita Bisa Melewati Tahun 2020 ,2020-05-01,mei,2020
Percakapan Whatsapp Mengatasnamakan Sekda Kota Surabaya ,2020-05-01,mei,2020
Rs Mitra Keluarga Menjual Surat Sehat Bebas Covid-19 di Toko Online ,2020-05-01,mei,2020
Ide dan Ajakan Menarik dari Kwik Kian Gie ,2020-05-01,mei,2020
Anak 10 Tahun Meninggal Dunia dan Jenazahnya Tertahan di Rumah Sakit Akibat  ,2020-05-01,mei,2020
Video “Jembatan Macau Hongkong Bergoyang” ,2020-05-01,mei,2020
Video Ribuan Burung Gagak Hitam Menyerbu AS di Tengah Pandemi Covid-19 ,2020-05-01,mei,2020
Laporan WHO : Vegetarian Tidak Terinfeksi Virus Corona ,2020-05-01,mei,2020
Foto Simpang Nagrek Keluar Masuk Ditutup Harus Balik Arah ,2020-05-01,mei,2020
Foto “SUDJIATMI DISIKSA DI ALAM BARZAKH” ,2020-05-01,mei,2020
Penjemputan Pasien Positif Covid-19 di Jalan Bajawa ,2020-05-01,mei,2020
Pasien Corona di RS Abdul Manaf Meninggal ,2020-05-01,mei,2020
Video Serangan Serangga Beracun di India Saat Pandemi Covid-19 ,2020-05-01,mei,2020
Perempuan Dihipnotis di Kelurahan Sebani ,2020-05-01,mei,2020
Video Telur Palsu Kembali Ditemukan di Subang ,2020-05-01,mei,2020
Pasein Positif Covid-19 Setelah Pulang di Bali Asal Pamotan Rembang Meninggal Dunia ,2020-05-01,mei,2020
Jalur Perbatasan Sintang Pinoh Ditutup Pemkab Melawi ,2020-05-01,mei,2020
14 Orang Terpapar Covid-19 di Lippo Plaza Kendari ,2020-05-01,mei,2020
Video “Gara-gara PSBB Manusia sampai Bertelur” ,2020-05-01,mei,2020
Beredar Daftar Ruas Jalan yang Ditutup selama PSBB Kabupaten Bengkalis ,2020-05-01,mei,2020
Viral Bupati Temanggung Nongkrong saat Pandemi Corona ,2020-05-01,mei,2020
Dua Anak Meninggal Akibat Vaksin Virus Corona Baru di Guinea ,2020-05-01,mei,2020
13 Pedagang di Pasar Cileungsi Positif Covid-19 ,2020-05-01,mei,2020
Pengelola Kebun Binatang Jurug Solo Tidak Sanggup Memberi Makan Satwa ,2020-05-01,mei,2020
Surat Penerimaan Sampel Covid-19 Diliburkan ,2020-05-01,mei,2020
Pembagian Sumbangan Dana Covid-19 Senilai R2 Juta ,2020-05-01,mei,2020
Pesan Berantai Mengenai Libur Sekolah Selama Idul Fitri di Jakarta ,2020-05-01,mei,2020
Lambang Kepresidenan Disangka Lambang Partai Komunis Tiongkok ,2020-05-01,mei,2020
Seluruh Tenaga Medis RS Muhammadiyah Palembang Positif Covid-19 ,2020-05-01,mei,2020
Video India Diserang Lebah di Tengah Pandemi Covid-19 ,2020-05-01,mei,2020
"Mau Jenius Seperti Saya, Minum Selalu Ajinomoto ",2020-05-01,mei,2020
Foto “Naik pesawat? Bebaaassss INDONESIA terserah lu ajah” ,2020-05-01,mei,2020
Ganjar Pranowo Bolehkan Warga Jawa Tengah Salat Idul Fitri ,2020-05-01,mei,2020
Penggunaan Masker Dapat Menyebabkan Hipoksia ,2020-05-01,mei,2020
Manager Giant Ekstra Meninggal karena Covid-19 ,2020-05-01,mei,2020
Pamflet Tentang Pelaksanaan Salat Idul Fitri di Kabupaten Gorontalo ,2020-05-01,mei,2020
Akun Facebook Gubernur Bengkulu Rohidin Mersyah ,2020-05-01,mei,2020
Paru-paru Pasien Covid 19 yang Sembuh akan Tetap Rusak ,2020-05-01,mei,2020
Badai Panas Equinox akan Terjadi di Indonesia pada Mei 2020 ,2020-05-01,mei,2020
Menhub Budi Karya Kembali Positif Covid-19 Setelah Dinyatakan Sembuh ,2020-05-01,mei,2020
Pemerintah Gelar Konser yang Langgar PSBB dan Menyinggung Umat Islam ,2020-05-01,mei,2020
Corona Mewabah Gubernur Ganjar Pranowo Liburkan Sales dan Karyawan Se-Jateng Selama  ,2020-05-01,mei,2020
Suami Perawat RS Royal Meninggal ,2020-05-01,mei,2020
Wapres Tidak Masalah Konser Di Bulan Ramadhan Malah Anda Ikut Nonton & Ikut Berdonasi  ,2020-05-01,mei,2020
Pengangkatan Tenaga Honorer Guru dan Administrasi ,2020-05-01,mei,2020
Program Mudik Sehat PSBB 2020 Blue Bird ,2020-05-01,mei,2020
Rapid Test di Bandara Soekarno-Hatta Bayar Rp55000 ,2020-05-01,mei,2020
Pemerintah Takkan Umumkan Lagi Kasus Positif Covid-19 ,2020-05-01,mei,2020
Begal Beraksi di Jalan Nangka Denpasar ,2020-05-01,mei,2020
Video Kecelakaan Tragis di Batu Kramat ,2020-05-01,mei,2020
"Foto ""ada antek china baru niee lagi minta sumbangan katanya APBD DKI lagi sekarat"" ",2020-05-01,mei,2020
Pengunjung Golden Swalayan Wajib Lapor RT karena Adanya Klaster Baru Covid 19 ,2020-05-01,mei,2020
Video Keramaian Pasar Andir Bandung Ditengah PSBB ,2020-05-01,mei,2020
Anies Potong Tunjangan Tenaga Medis saat Pandemi Covid-19 ,2020-05-01,mei,2020
Video Warga Sumbar Usir Turis China dan Bakar Perusahaannya Saat Pandemi Covid-19 ,2020-05-01,mei,2020
Foto Kepala Dusun Dihakimi Warga akibat Sembako Corona tidak Tepat Sasaran ,2020-05-01,mei,2020
Daftar Virus yang Berasal dari China ,2020-05-01,mei,2020
Video Keramaian Pasar di Palembang Saat Pandemi Covid-19 ,2020-05-01,mei,2020
Pedagang di Pasar Kordon Kota Bandung Positif Covid-19 ,2020-05-01,mei,2020
Pasar Cimahi 40 Orang Positif Corona ,2020-05-01,mei,2020
Hong Kong Perbolehkan Salat Idulfitri di Masjid ,2020-05-01,mei,2020
Majalah Italia Tahun 1962 Menggambarkan yang Akan Terjadi Pada Tahun 2022 ,2020-05-01,mei,2020
Video Kepanikan Warga Pesisir Laut Kabupaten Subang Akibat Terjadinya Tsunami ,2020-05-01,mei,2020
Konser Virtual Covid-19 Perayaan Ulang Tahun ke-100 PKI ,2020-05-01,mei,2020
PDIP Minta Presiden Jokowi Diperiksa KPK ,2020-05-01,mei,2020
Video Suasana Pasar Tanah Abang Dipadati Masyarakat saat PSBB ,2020-05-01,mei,2020
Pembuluh Darah Mata Pecah akibat Begadang ,2020-05-01,mei,2020
Jokowi Dikabarkan Siap Pindah Jadi Warga Negara Singapura Jika Lengser ,2020-05-01,mei,2020
7 Orang Meninggal dalam Sehari di RSUD Dr Moewardi ,2020-05-01,mei,2020
Klaim Dua Dokter Amerika Terkait Covid-19 Tidak Mematikan ,2020-05-01,mei,2020
Penutupan Pasar Raya Solok ,2020-05-01,mei,2020
Potret Pemandangan Alam di Papua Indonesia ,2020-05-01,mei,2020
"Video “TKA CHINA MASUK PALEMBANG DENGAN APD LENGKAP, BIAR DIKIRA  ",2020-05-01,mei,2020
Video Pasien Positif Corona Kabur dari Rumah Sakit di Yogyakarta ,2020-05-01,mei,2020
Habib Umar Abdullah Assegaf Menggunakan STNK Palsu ,2020-05-01,mei,2020
WHO: Pria Berpenis Besar Lebih Rentan Tertular Covid-19 ,2020-05-01,mei,2020
"Hasil Riset Singapura, Corona di Indonesia Berakhir 6 Juni 2020 ",2020-05-01,mei,2020
Pesan Suara Berantai Adanya Kawanan Maling Akan Melancarkan Aksi Kejahatannya di  ,2020-05-01,mei,2020
Pemerintah Indonesia Akan Terapkan Herd Immunity Setelah PSBB ,2020-05-01,mei,2020
2 Kasir Chandra Karang Positif Covid-19 ,2020-05-01,mei,2020
PDIP Usul ke Pemerintah agar Pesantren Ditutup Seluruh Indonesia ,2020-05-01,mei,2020
"Puan “Jika Negara Ingin Maju dan berkembang, Pendidikan Agama Islam harus dihapus” ",2020-05-01,mei,2020
Tanah Longsor Besar di Jalan Guwahati-Shillong India ,2020-05-01,mei,2020
FBI Menangkap Bill Gates ,2020-05-01,mei,2020
Pegawai Luwes Gading Dijemput Paksa Karena Positif Corona ,2020-05-01,mei,2020
Sidak & Tes Covid-19 di Mal Paragon Solo ,2020-05-01,mei,2020
Karyawan Q Mall Banjarbaru Positif Covid-19 ,2020-05-01,mei,2020
Video Bimbim SLANK : Peace Komunis ,2020-05-01,mei,2020
Jakarta - Bandung Sudah Tidak Lockdown ,2020-05-01,mei,2020
Indonesia Akan Dilockdown Dunia ,2020-05-01,mei,2020
Bantuan Pemerintah Daerah untuk Warga Sulut di Jakarta ,2020-05-01,mei,2020
PBB Menolak Mengirim Bantuan Covid-19 Ke Negara Yang Tidak Melegalkan Aborsi ,2020-05-01,mei,2020
Pesan Berantai Pasien Positif Covid-19 Melarikan Diri Karena Takut Dikarantina ,2020-05-01,mei,2020
Bendera Tiongkok Berkibar di Maluku Utara ,2020-05-01,mei,2020
Video Takbiran Idul Fitri 2020 di Aceh ,2020-05-01,mei,2020
Ellen DeGeneres Bagikan Uang ke 10 ribu Pengguna Facebook saat Pandemi Covid-19 ,2020-05-01,mei,2020
Surat Mengatasnamakan MUI agar Ulama Hati-hati dan Melawan saat Rapid Test ,2020-05-01,mei,2020
Akun WhatsApp Direktur Rumah Sakit Harapan dan Doa (RSHKota Bengkulu ,2020-05-01,mei,2020
Iwan Fals akan Gelar Konser dalam Rangka Ultah PKI ,2020-05-01,mei,2020
Foto Pesawat PIA A320 sebelum Kecelakaan ,2020-05-01,mei,2020
Voucher Dua Pizza Besar Domino’s Pizza Selama Masa Pandemi Corona ,2020-05-01,mei,2020
China dan Jepang Kembali Lockdown Karena Virus Corona Gelombang Kedua ,2020-05-01,mei,2020
"Pesan Aa Gym ""Perjuangan Kita Menahan Diri di Rumah Aja Dikhianati Lagi"" ",2020-05-01,mei,2020
PSBB Palembang Tutup Jalan Jam 2 Siang ,2020-05-01,mei,2020
"Video Pangandaran Dilanda Tsunami Usai Gempa Magnitudo 5,1 SR saat Lebaran ",2020-05-01,mei,2020
Bakteri Jadi Penyebab Kematian pada Pasien Covid-19 ,2020-05-01,mei,2020
Kaesang Nyatakan Masalah Virus Corona di Jakarta Bisa Diatasi jika Dirinya Jadi Gubernur ,2020-05-01,mei,2020
31 Orang Polisi Polres Mamuju Terpapar Covid-19 ,2020-05-01,mei,2020
Puasa Ramadhan Harus Diulang ,2020-05-01,mei,2020
Pasien Covid-19 Asal Kabupaten Murung Raya Kabur ,2020-05-01,mei,2020
Akun Facebook Mengatasnamakan Kapolres Tanjabbar ,2020-05-01,mei,2020
Mamah Dedeh Meninggal Dunia ,2020-05-01,mei,2020
Foto Penampakan Tol Langit yang Pernah Dilewati Mobil ESEMKA ,2020-05-01,mei,2020
Kemendikbud Buka Kembali Sekolah pada Bulan Juli ,2020-05-01,mei,2020
Komunis Bebas Berkeliaran Para Habib di Dzolimi ,2020-05-01,mei,2020
Kewajiban Penggunaan Aplikasi Pelacakan Kontak Virus Corona di Selandia Baru ,2020-05-01,mei,2020
Jalur Pendakian Gunung Penanggungan Via Jolotundo Telah Dibuka ,2020-05-01,mei,2020
Akun Whatsapp Mengatasnamakan Kadinkes Bengkulu Minta Transfer Uang ,2020-05-01,mei,2020
Garam Dapur Bisa Atasi Batuk dan Bunuh Virus Corona ,2020-05-01,mei,2020
"Di Italia Ketika Gereja Dibuka Kembali, Hampir Semua Jemaatnya Sudah Meninggal Karena  ",2020-05-01,mei,2020
TKA Tiongkok Tertangkap saat Masuk Bandara Banyuwangi ,2020-05-01,mei,2020
Satu Keluarga Positif Corona Usai Shalat Id ,2020-05-01,mei,2020
Seluruh Petugas Laboratorium UNAIR Positif Covid-19 ,2020-05-01,mei,2020
Sayonara The Jakarta Post ,2020-05-01,mei,2020
Ruhut Sitompul Dilantik Jadi Anggota BPIP ,2020-05-01,mei,2020
Akun Facebook Mengatasnamakan Istri Gubernur Sulawesi Selatan ,2020-05-01,mei,2020
Penyerangan dan Perampasan Amunisi TNI-Polri di Nduga ,2020-05-01,mei,2020
Dua Orang Positif Covid-19 Meninggal di Selorejo Kota Malang ,2020-05-01,mei,2020
Penggunaan Masker Wajah dalam Waktu Lama dapat Menyebabkan Hiperkapnia ,2020-05-01,mei,2020
Obat Covid-19 Tocilizumab Bisa Sembuhkan 90 Persen Meski Kondisi Pasien Kritis ,2020-05-01,mei,2020
Motor Terbakar di Jember Gara-gara Hand Sanitizer ,2020-05-01,mei,2020
Ajakan Tidak Mendatangi Mall Karena Bahaya Jamur AC yang Menyebabkan Kematian ,2020-05-01,mei,2020
Megawati Potong Tumpeng di Atas Meja Berlogo PKI ,2020-05-01,mei,2020
PKI Semakin Berani Perlihatkan Wujudnya Lewat Sepatu ,2020-05-01,mei,2020
Pesan WhatsApp Mengatasnamakan Pri Hartono Kepala Desa Bedoro ,2020-05-01,mei,2020
Pasien Positif Covid-19 Kabur dari RS Cibabat Kota Cimahi ,2020-05-01,mei,2020
Sms Voucher Game Mengatasnamakan Indomaret ,2020-05-01,mei,2020
China dan Iran Terkena Pandemi Serangga Mematikan Selama Krisis Virus Corona ,2020-05-01,mei,2020
"Video ""Kisah pilu dari ITALY IBU nya meninggal pasien COVID-19"" ",2020-05-01,mei,2020
Covid-19 Hanya Flu Biasa dan Hasil Rekayasa untuk Cari Untung ,2020-05-01,mei,2020
"Pemudik Bisa Masuk Jakarta Setelah 7 Juni, Tanpa Harus Membawa SIKM ",2020-05-01,mei,2020
Puluhan Tahanan di Jayapura Positif Covid-19 ,2020-05-01,mei,2020
Daun Sungkai Bisa Menyembuhkan Virus Corona ,2020-05-01,mei,2020
Kiai Ghofur Didatangi Pihak Polres Lamongan karena Tidak Meliburkan Santrinya ,2020-05-01,mei,2020
Usia 50 ke Atas Dilarang Masuk Mall Hingga Makan di Kafe pada Fase New Normal ,2020-05-01,mei,2020
Pesan Palsu Mengatasnamakan Plt Kadinkes Kota Pasuruan ,2020-05-01,mei,2020
"Akun Palsu FB Mencatut Nama Anggota DPRD Kota Pekanbaru Riau, Robin Eduar ",2020-05-01,mei,2020
Polisi Benarkan Ada Upaya dari FPI dalam Penyebar Kaos & Atribut PKI ,2020-05-01,mei,2020
Pesan dari Dekan FMIPA IPB Terkait Virus Hanya Bisa Dikalahkan oleh Antibodi ,2020-05-01,mei,2020
Foto Longsor di Jalan Tol Semarang-Solo Arah Jakarta ,2020-05-01,mei,2020
The Rock Dwayne Johnson Beri Uang untuk Pengguna Facebook di Tengah Wabah Covid-19 ,2020-06-01,juni,2020
Akun Facebook Mengatasnamakan Wakil Walikota Manado Mor Bastiaan ,2020-06-01,juni,2020
Satu Orang Pasien Positif Covid-19 di RT 5 Kelurahan Mendawai Kotawaringin Barat ,2020-06-01,juni,2020
Video Pembatasan Aktivitas di Surabaya Mulai 1 Juni ,2020-06-01,juni,2020
Covid-19 Bisa Disembuhkan dengan Minyak Kayu Putih ,2020-06-01,juni,2020
"Viral Warung Makan di Pantai Tanjung Pakis Gurame Seharga Rp 1,3 Juta ",2020-06-01,juni,2020
Makan Salad Pepaya dapat Mencegah Infeksi dari Virus Corona ,2020-06-01,juni,2020
Metro Tv Akui Anies Adalah Presiden RI ,2020-06-01,juni,2020
"PKI Didukung TKA, Foto Penangkapan Militer RRC yang Menyamar Jadi Pekerja LRT di Karawang ",2020-06-01,juni,2020
Gedung Putih AS Disebut Dimasuki Para Demonstran ,2020-06-01,juni,2020
Website Palsu PPDB SMKN 1 Kota Sukabumi ,2020-06-01,juni,2020
Covid-19 Disebabkan oleh Bakteri yang Menyebabkan Pembekuan Darah ,2020-06-01,juni,2020
Undangan Interview PT Waskita Karya Tanggal 3 -4 Juni 2020 ,2020-06-01,juni,2020
Dua Pedagang Pasar Rasamala Banyumanik Positif Covid-19 ,2020-06-01,juni,2020
Seorang Pria Dikabarkan Hamil ,2020-06-01,juni,2020
Menko Luhut Imbau Petani Kurangi Tanam Sayur Terkait Impor China ,2020-06-01,juni,2020
"12 Orang Positif Covid-19 di Tenggiri, Samarinda ",2020-06-01,juni,2020
TNI sudah Mulai Turun Menjaga Ruslan Buton ,2020-06-01,juni,2020
Pesepeda Meninggal di Monas Karena Memakai Masker ,2020-06-01,juni,2020
Petugas Rapid Test Jarang Mengganti Sarung Tangan ,2020-06-01,juni,2020
Jangan ke Rumah Sakit meski Alami Gejala Covid-19 ,2020-06-01,juni,2020
BNI Hubungi Nasabah untuk Pendaftaran Layanan SMS Notifikasi ,2020-06-01,juni,2020
30 Asisten Rumah Tangga di Daerah Penjaringan Dinyatakan Positif Covid-19 ,2020-06-01,juni,2020
Video Perayaan Ulang Tahun ke-100 PKI ,2020-06-01,juni,2020
Puan Maharani Menambahkan Kata Pro Rakyat Dalam Pembukaan UUD 1945 ,2020-06-01,juni,2020
Dokter di RS Manado Sogok Keluarga Pasien PDP Covid-19 ,2020-06-01,juni,2020
Video Mahasiswa Unjuk Rasa Tuntut Jokowi Mundur di Tengah Pandemi ,2020-06-01,juni,2020
ITC Mangga Dua Buka 30 Juni ,2020-06-01,juni,2020
Helmy Yahya Dipecat dari Dirut TVRI karena Pemutaran Film G30S/PKI ,2020-06-01,juni,2020
Foto- foto Pemerintah Malaysia Sapu Habis WNA Termasuk TKI Saat Pandemi Covid-19 ,2020-06-01,juni,2020
Surat Mengatasnamakan Kemenkeu Mengenai Keterangan Penggunaan Dana Transfer Umum Sektor DBH  ,2020-06-01,juni,2020
Dua Pedagang di Pasar Sumber Negatif Covid-19 ,2020-06-01,juni,2020
Lambang PKI di Dalam Gedung Wilayah Jakarta Pusat ,2020-06-01,juni,2020
Akun Twitter Luhut Binsar Pandjaitan ,2020-06-01,juni,2020
The Simpsons Sudah Memprediksi Kematian George Floyd ,2020-06-01,juni,2020
Kota Surabaya dari Zona Merah Menjadi Zona Hitam ,2020-06-01,juni,2020
"""Beda KelaDulu Kelas VVIP Sekarang Kelas Ekonomi"" ",2020-06-01,juni,2020
Pasien COVID-19 Dikabarkan Ikut Lulo di Bakealu ,2020-06-01,juni,2020
Keputusan Gubernur DKI Jakarta nomor 412 Tahun 2020 Perpanjangan PSBB 5 sampai 18 Juni 2020 ,2020-06-01,juni,2020
Foto Sejumlah Anggota PKI Angkat Senjata ,2020-06-01,juni,2020
Foto AS Negara Paling Rasis ,2020-06-01,juni,2020
Foto Mayat Korban Covid-19 di Pakistan ,2020-06-01,juni,2020
Petugas Terima Uang dari Pemudik yang Akan Masuk Provinsi Aceh ,2020-06-01,juni,2020
Akun Twitter Mengatasnamakan Novel Baswedan ,2020-06-01,juni,2020
Seorang Pasien Menderita Penyakit Baru karena Mengkonsumsi Tepung Semolina ,2020-06-01,juni,2020
UTBK-SBMPTN Diperpanjang ,2020-06-01,juni,2020
Garuda Plaza Hotel Dijual Rp 300 M ,2020-06-01,juni,2020
Rezim Jokowi Hapus TAP MPR Tentang Larangan Ajaran Komunisme ,2020-06-01,juni,2020
La Gode Menyerang Asrama TNI ,2020-06-01,juni,2020
George Floyd Meninggal Karena Ditembak Polisi AS ,2020-06-01,juni,2020
Dokter Jadikan Pademi Covid 19 Sebagai Lahan Mata Pencaharian ,2020-06-01,juni,2020
Petugas PKI yang Menyamar Sebagai Dokter ,2020-06-01,juni,2020
Legenda Argentina Diego Maradona jadi Gendut Akibat Virus Corona ,2020-06-01,juni,2020
Parahnya Kasus Covid-19 di Surabaya adalah Konspirasi Elite Global ,2020-06-01,juni,2020
PBGA Group Buka Lowongan Pekerjaan Ditengah Pandemi Covid-19 ,2020-06-01,juni,2020
Kebijakan Bank Bukopin Batasi Penarikan Tunai Mulai 2 Juni 2020 ,2020-06-01,juni,2020
Foto Penampakan Presiden Jokowi Gunakan Sepatu di Dalam Masjid ,2020-06-01,juni,2020
Foto Jalan dan Terowongan Merupakan Kemajuan di Indonesia ,2020-06-01,juni,2020
Foto Tenggorokan Pasien yang Terinfeksi Virus Corona ,2020-06-01,juni,2020
. 181 Pilot Garuda Indonesia Di-PHK ,2020-06-01,juni,2020
Gubernur Kalbar Memakai Sepatu di Dalam Masjid ,2020-06-01,juni,2020
Video “TERCIDUK ANJING PKI YANG MENGOTORI MASJID” ,2020-06-01,juni,2020
Foto Anies Baswedan Sedang Coret-Coret di Masjid ,2020-06-01,juni,2020
Akun Facebook Wakil Walikota Sukabumi ,2020-06-01,juni,2020
Panggilan Seleksi Rekruitmen Karyawan PT Pertamina pada Tanggal 7-8 Juni 2020 ,2020-06-01,juni,2020
Kapan FPI Memenuhi Janji Bunuh Diri Massal ,2020-06-01,juni,2020
Zinc dan Air Tonik Dapat Mengobati Covid-19 ,2020-06-01,juni,2020
Foto Perdana Menteri Jepang dan Presiden Filipina di Museum Nasional di Jepang ,2020-06-01,juni,2020
Sopir logistik Ikan Dipukul Petugas Covid 19 ,2020-06-01,juni,2020
Isi Tulisan yang Berjudul Dugaan Konspirasi Covid-19 Bukan Isapan Jempol ,2020-06-01,juni,2020
Akun Palsu dengan Memakai Foto Anggota TNI AD Melakukan Ujaran Kebencian Terhadap Presiden Jokowi ,2020-06-01,juni,2020
Imigrasi Tahan 300 WN Tiongkok Pembawa 000 Senjata Api ,2020-06-01,juni,2020
Pemerintah akan Cabut Subsidi Elpiji 3 Kg Juli 2020 ,2020-06-01,juni,2020
Dirut PLN Terkejut Tagihan Listrik di Rumahnya Naik 100 Persen ,2020-06-01,juni,2020
"Santri yang Hidupnya di Pondok Dicurigai Terpapar Covid-19, yang Keluyuran di Mall Dibiarin Aja ",2020-06-01,juni,2020
Wapres: Ikhlaskan Saja Dana Haji Dipakai Pemerintah agar Kalian Masuk Surga ,2020-06-01,juni,2020
